Unnamed: 0,id,type,title,content,text,score,num_comments,created_utc,parent_id,sentiment,url,label
19977,m84hm0e,comment,,"A long time ago I was dating someone with a precious 6-year old girl. Her parents and step parent were all good people doing their best to be good parents. But for some reason, this girl got it into herself that she was stupid. The first time she told me she was stupid, it broke my heart. I as sure she was comparing herself to someone, and in her little mind she was coming up short.

She was very creative and we’d spend hours doing some sort of creative thing or another. That is when I first read the advice I mentioned above. I really wanted to be a good auntie to her and was terrified the very poor parenting I got as a child would come out at her. I read a lot of parenting advice and kept following the ones that produced good results. 

So, I started using this advice with her every time she showed me her work, or when we were crafting together. It lead to so many interesting conversations that were very eye opening for me. I learned a lot from that kid! Love her to this day. 

She is now a woman in her mid 20’s and an artist in her own right. I get photos of her exhibits and I couldn’t be more proud of her. And, yes, somewhere along the line she stopped believing she was stupid. We could all use more questions from loved ones that express genuine interest in things that matter to us, especially when it comes to our creative expression. I hope you find such people in your life."," A long time ago I was dating someone with a precious 6-year old girl. Her parents and step parent were all good people doing their best to be good parents. But for some reason, this girl got it into herself that she was stupid. The first time she told me she was stupid, it broke my heart. I as sure she was comparing herself to someone, and in her little mind she was coming up short.

She was very creative and we’d spend hours doing some sort of creative thing or another. That is when I first read the advice I mentioned above. I really wanted to be a good auntie to her and was terrified the very poor parenting I got as a child would come out at her. I read a lot of parenting advice and kept following the ones that produced good results. 

So, I started using this advice with her every time she showed me her work, or when we were crafting together. It lead to so many interesting conversations that were very eye opening for me. I learned a lot from that kid! Love her to this day. 

She is now a woman in her mid 20’s and an artist in her own right. I get photos of her exhibits and I couldn’t be more proud of her. And, yes, somewhere along the line she stopped believing she was stupid. We could all use more questions from loved ones that express genuine interest in things that matter to us, especially when it comes to our creative expression. I hope you find such people in your life.",2,,2025-01-20 06:54:13,t1_m84561q,,https://www.reddit.com/r/confession/comments/1i5dc48/ive_been_lying_to_my_stepkid_to_keep_the_peace_in/m84hm0e/,Neutral
19978,m83ab8o,comment,,"Yikes. Do NOT let your kid become an ipad baby. 

I’m sure that would be a conversation that’s more than a reddit thread could fix, but I suggest promoting more outdoor activities, and do things to instill value in creation and self expression. Don’t know if you’ve seen that google(?) ad with the kids using ai for their imagination but this is the exact issue they tried to make look like a good thing. 

I know parenting is hard so try not to beat yourself up over it or anything. It’s difficult when you have another parent in the picture okaying something you’re against"," Yikes. Do NOT let your kid become an ipad baby. 

I’m sure that would be a conversation that’s more than a reddit thread could fix, but I suggest promoting more outdoor activities, and do things to instill value in creation and self expression. Don’t know if you’ve seen that google(?) ad with the kids using ai for their imagination but this is the exact issue they tried to make look like a good thing. 

I know parenting is hard so try not to beat yourself up over it or anything. It’s difficult when you have another parent in the picture okaying something you’re against",1,,2025-01-20 01:53:01,t1_m8396n7,,https://www.reddit.com/r/confession/comments/1i5dc48/ive_been_lying_to_my_stepkid_to_keep_the_peace_in/m83ab8o/,Neutral
19979,m832bbo,comment,,lmao just say you don’t like the opinion. Awkwardly wedging that into some weird “well you identify as” insult really doesn’t give merit to this identity concept…, lmao just say you don’t like the opinion. Awkwardly wedging that into some weird “well you identify as” insult really doesn’t give merit to this identity concept…,-2,,2025-01-20 01:08:37,t1_m82z3hn,,https://www.reddit.com/r/confession/comments/1i5dc48/ive_been_lying_to_my_stepkid_to_keep_the_peace_in/m832bbo/,Neutral
19980,m836eq9,comment,,"You want them to feel creative and that they accomplished something with their work lol. You straight up admitted you don’t feel they’re creative, but lied anyway to keep them happy. It falls in the same theme of enabling the mindset that just because they think they’re a certain way, everyone else has to play along. Especially at 9 years old. It’s setting them up to be extremely entitled. It’s just socially acceptable to call out AI art as being bullshit."," You want them to feel creative and that they accomplished something with their work lol. You straight up admitted you don’t feel they’re creative, but lied anyway to keep them happy. It falls in the same theme of enabling the mindset that just because they think they’re a certain way, everyone else has to play along. Especially at 9 years old. It’s setting them up to be extremely entitled. It’s just socially acceptable to call out AI art as being bullshit.",6,,2025-01-20 01:31:24,t1_m835nwu,,https://www.reddit.com/r/confession/comments/1i5dc48/ive_been_lying_to_my_stepkid_to_keep_the_peace_in/m836eq9/,Neutral
19981,m8391g9,comment,,"Nope, just saying that everything OP has said about how the kid is being raised is the sort of thing that leads kids growing up to being entitled.

I never complained about someone not liking my opinion, read the comment again. If they want me to take what someone identifies as seriously, then they can’t use it in an insult of their own lmfao"," Nope, just saying that everything OP has said about how the kid is being raised is the sort of thing that leads kids growing up to being entitled.

I never complained about someone not liking my opinion, read the comment again. If they want me to take what someone identifies as seriously, then they can’t use it in an insult of their own lmfao",4,,2025-01-20 01:45:52,t1_m837tmp,,https://www.reddit.com/r/confession/comments/1i5dc48/ive_been_lying_to_my_stepkid_to_keep_the_peace_in/m8391g9/,Neutral
19982,m83b0ys,comment,,"I became a stepdad too late to stop that process, and it's partially the reason why I'm not going to have more kids. 

The best I've been able to do is to curb it by starting off with PokeGo walks > regular walks without tech > longer stretches > art moments with just music as tech etc.

And they're currently fighting with their biodad on their 30 minutes of mandatory talking at night. It's so fun having to calm your child down _just before bedtime_ because their dad is seeking arguments. It's a shitshow."," I became a stepdad too late to stop that process, and it's partially the reason why I'm not going to have more kids. 

The best I've been able to do is to curb it by starting off with PokeGo walks > regular walks without tech > longer stretches > art moments with just music as tech etc.

And they're currently fighting with their biodad on their 30 minutes of mandatory talking at night. It's so fun having to calm your child down _just before bedtime_ because their dad is seeking arguments. It's a shitshow.",1,,2025-01-20 01:57:00,t1_m83ab8o,,https://www.reddit.com/r/confession/comments/1i5dc48/ive_been_lying_to_my_stepkid_to_keep_the_peace_in/m83b0ys/,Neutral
19983,m839049,comment,,"Sorry to pivot away from the original point here, but isnt any societal idea a ""certain way that everyone else has to play along with""?

And yes, AI art is bullshit, but it still is a tool that can be used for inspiration or leveling out workload to afford good wages."," Sorry to pivot away from the original point here, but isnt any societal idea a ""certain way that everyone else has to play along with""?

And yes, AI art is bullshit, but it still is a tool that can be used for inspiration or leveling out workload to afford good wages.",0,,2025-01-20 01:45:40,t1_m836eq9,,https://www.reddit.com/r/confession/comments/1i5dc48/ive_been_lying_to_my_stepkid_to_keep_the_peace_in/m839049/,Neutral
19984,m839n5c,comment,,"Don’t know where you’re getting “societal idea” from, I was talking about how your stepkid thinks of himself. That’s as individual as it gets."," Don’t know where you’re getting “societal idea” from, I was talking about how your stepkid thinks of himself. That’s as individual as it gets.",2,,2025-01-20 01:49:14,t1_m839049,,https://www.reddit.com/r/confession/comments/1i5dc48/ive_been_lying_to_my_stepkid_to_keep_the_peace_in/m839n5c/,Neutral
19985,m82xhyi,comment,,I’m not a gun expert but I honestly wouldn’t feel comfortable using that gun ever again if that happened to me and you were pretty sure you didn’t press the trigger. Sounds defective. This is also why I have a physical safety on my guns., I’m not a gun expert but I honestly wouldn’t feel comfortable using that gun ever again if that happened to me and you were pretty sure you didn’t press the trigger. Sounds defective. This is also why I have a physical safety on my guns.,7,,2025-01-20 00:42:58,t3_1i5danm,,https://www.reddit.com/r/confession/comments/1i5danm/nd_negligent_discharge_i_shot_my_truck_usa_gun/m82xhyi/,Neutral
19986,m835kuo,comment,,"Well there's your first problem:  Canik junk
Secondly sounds like you could use some further training and safety education."," Well there's your first problem:  Canik junk
Secondly sounds like you could use some further training and safety education.",5,,2025-01-20 01:26:46,t3_1i5danm,,https://www.reddit.com/r/confession/comments/1i5danm/nd_negligent_discharge_i_shot_my_truck_usa_gun/m835kuo/,Neutral
19987,m83dni7,comment,,"Treat every gun as if it is loaded.  Never point your weapon at anything you do not intend to destroy.  Keep your weapon on safe until you intend to fire.  Keep your finger straight and off the trigger until you intend to fire.  

Weapon malfunctions do happen. That is why there is more than on safety rule.  However, there is a personal problem when you cleared the weapon, and it still discharged a round.  Thank your stars, take the lesson, and don't forget it.  Complacency kills."," Treat every gun as if it is loaded.  Never point your weapon at anything you do not intend to destroy.  Keep your weapon on safe until you intend to fire.  Keep your finger straight and off the trigger until you intend to fire.  

Weapon malfunctions do happen. That is why there is more than on safety rule.  However, there is a personal problem when you cleared the weapon, and it still discharged a round.  Thank your stars, take the lesson, and don't forget it.  Complacency kills.",5,,2025-01-20 02:11:46,t3_1i5danm,,https://www.reddit.com/r/confession/comments/1i5danm/nd_negligent_discharge_i_shot_my_truck_usa_gun/m83dni7/,Neutral
19988,m83078l,comment,,"Couple things: obviously guns are loaded with risk, also, sounds like you were overexcited, and that gun is a piece of shit.


I'd return it if you can and get a real piece of quality.


Being so young, why not get something that will last and you'll grow with, and not perforate your truck and shoot your neighbors with?"," Couple things: obviously guns are loaded with risk, also, sounds like you were overexcited, and that gun is a piece of shit.


I'd return it if you can and get a real piece of quality.


Being so young, why not get something that will last and you'll grow with, and not perforate your truck and shoot your neighbors with?",3,,2025-01-20 00:57:07,t3_1i5danm,,https://www.reddit.com/r/confession/comments/1i5danm/nd_negligent_discharge_i_shot_my_truck_usa_gun/m83078l/,Neutral
19989,m830c2x,comment,,"Hey man don’t beat yourself up too bad. I’ll share with you my ND story:

I had just got in a new magwell for one of my pistols. Sat down on the sofa and went got it installed. Started doing some reloading reps and accidentally popped a shot off into my 86” TV. Then it hit the only water line in my entire wall (fire sprinkler line so I had to call 911). Immediately cleared the handgun and ran to my back room to check and see if the round went through the other wall. It didn’t (I found it and keep it around as a reminded). Called 911 and reported them, was on hold for 4 minutes even though the fire house is less than a minute away. The whole time water is flooding my apartment and my downstairs neighbor and their downstairs neighbor. I only had floor and trim damage and lost a couple blankets. My downstairs neighbors lost their entire apartments as it absolutely rained on them. I was out of my apartment for months and lucky enough I could stay with my mom, but the downstairs neighbors of mine had to go to the Red Cross to find housing. I felt and still feel like shit over it. Both of them moved out and I never got to see them to apologize and try to make amends for my boneheadedness. The apartments were all covered by insurance, and I got a payment for my TV. They said no harm, no foul and it won’t be going on my record. I am lucky the water pipe caught my bullet and depleted a lot of its energy or else it would have gone through the other wall and possibly into another apartment. I’d like to add I’m US Marine, and firearms safety has been quite literally beat into me. 

Take this as an incredible learning opportunity and always be conscious of the condition of your firearm."," Hey man don’t beat yourself up too bad. I’ll share with you my ND story:

I had just got in a new magwell for one of my pistols. Sat down on the sofa and went got it installed. Started doing some reloading reps and accidentally popped a shot off into my 86” TV. Then it hit the only water line in my entire wall (fire sprinkler line so I had to call 911). Immediately cleared the handgun and ran to my back room to check and see if the round went through the other wall. It didn’t (I found it and keep it around as a reminded). Called 911 and reported them, was on hold for 4 minutes even though the fire house is less than a minute away. The whole time water is flooding my apartment and my downstairs neighbor and their downstairs neighbor. I only had floor and trim damage and lost a couple blankets. My downstairs neighbors lost their entire apartments as it absolutely rained on them. I was out of my apartment for months and lucky enough I could stay with my mom, but the downstairs neighbors of mine had to go to the Red Cross to find housing. I felt and still feel like shit over it. Both of them moved out and I never got to see them to apologize and try to make amends for my boneheadedness. The apartments were all covered by insurance, and I got a payment for my TV. They said no harm, no foul and it won’t be going on my record. I am lucky the water pipe caught my bullet and depleted a lot of its energy or else it would have gone through the other wall and possibly into another apartment. I’d like to add I’m US Marine, and firearms safety has been quite literally beat into me. 

Take this as an incredible learning opportunity and always be conscious of the condition of your firearm.",3,,2025-01-20 00:57:50,t3_1i5danm,,https://www.reddit.com/r/confession/comments/1i5danm/nd_negligent_discharge_i_shot_my_truck_usa_gun/m830c2x/,Neutral
19990,m832g4p,comment,,"I don't doubt you, but the way your story is written it's either impossible or you got a major problem with your gun. That you had a mag out and racked the slide should have cleared the gun. So somehow there's still a round in the hole and racking the slide did not eject it? broken gun or something about the story isn't right."," I don't doubt you, but the way your story is written it's either impossible or you got a major problem with your gun. That you had a mag out and racked the slide should have cleared the gun. So somehow there's still a round in the hole and racking the slide did not eject it? broken gun or something about the story isn't right.",3,,2025-01-20 01:09:22,t3_1i5danm,,https://www.reddit.com/r/confession/comments/1i5danm/nd_negligent_discharge_i_shot_my_truck_usa_gun/m832g4p/,Neutral
19991,m838yl8,comment,,"I was always the person to never drink and mess with guns, one night got drunk as hell and started cleaning my shotgun through I had racked all the shells out, accidentally pulled the trigger while the barrel was luckily way above my head and neck and shot a hole into the roof, my last thoughts were if. I’m gonna die I’m gonna feel my brain so I touched my head and it was still intact, had a crazy adrenaline rush, to this day I am super safe about guns"," I was always the person to never drink and mess with guns, one night got drunk as hell and started cleaning my shotgun through I had racked all the shells out, accidentally pulled the trigger while the barrel was luckily way above my head and neck and shot a hole into the roof, my last thoughts were if. I’m gonna die I’m gonna feel my brain so I touched my head and it was still intact, had a crazy adrenaline rush, to this day I am super safe about guns",3,,2025-01-20 01:45:25,t3_1i5danm,,https://www.reddit.com/r/confession/comments/1i5danm/nd_negligent_discharge_i_shot_my_truck_usa_gun/m838yl8/,Neutral
19992,m83b5tq,comment,,"I had an iwi masada that started occasionally firing when the slide was dropped. Luckily when it happened to me it was at a range and not when I was about to put it in my pants to carry. 

Kinda sounds to me like what happened to you. A ND caused by a mechanical failure."," I had an iwi masada that started occasionally firing when the slide was dropped. Luckily when it happened to me it was at a range and not when I was about to put it in my pants to carry. 

Kinda sounds to me like what happened to you. A ND caused by a mechanical failure.",3,,2025-01-20 01:57:47,t3_1i5danm,,https://www.reddit.com/r/confession/comments/1i5danm/nd_negligent_discharge_i_shot_my_truck_usa_gun/m83b5tq/,Neutral
19993,m82w707,comment,,"Further context: The gun is a Canik TPSFX chambered in 9mm. I actually kept the brass and decided to check it just now, and it appears to have jammed somehow in the chamber due to the outer rim where the bullet itself is seated, having been bent by the extractor."," Further context: The gun is a Canik TPSFX chambered in 9mm. I actually kept the brass and decided to check it just now, and it appears to have jammed somehow in the chamber due to the outer rim where the bullet itself is seated, having been bent by the extractor.",2,,2025-01-20 00:36:05,t3_1i5danm,,https://www.reddit.com/r/confession/comments/1i5danm/nd_negligent_discharge_i_shot_my_truck_usa_gun/m82w707/,Neutral
19994,m832o6g,comment,,Life must be so amazing in America., Life must be so amazing in America.,2,,2025-01-20 01:10:35,t3_1i5danm,,https://www.reddit.com/r/confession/comments/1i5danm/nd_negligent_discharge_i_shot_my_truck_usa_gun/m832o6g/,Neutral
19995,m836u2h,comment,,"If you had no magazine in the gun, then how did the slide lock back after it went off? Sounds more like you still had a round in the mag, and when you racked the slide to check it, you put one in the chamber."," If you had no magazine in the gun, then how did the slide lock back after it went off? Sounds more like you still had a round in the mag, and when you racked the slide to check it, you put one in the chamber.",2,,2025-01-20 01:33:45,t3_1i5danm,,https://www.reddit.com/r/confession/comments/1i5danm/nd_negligent_discharge_i_shot_my_truck_usa_gun/m836u2h/,Neutral
19996,m82uoh7,comment,,"No amount of safeties and procedures are going to reduce the risk of injury and death a gun creates\~\~. You cannot procedure your way out of that.\~\~

**Edit:  Sorry, I sent the entirely wrong message here. no amount of safety procedures reduce the risk of injury and death a gun creates to zero. Gun safety procedures are important. But it needs to be understood that a gun ALWAYS carries a risk of injury or death no matter what you do.**

It's like using a tablesaw in the workplace. If you are interacting with the tool, there's a chance it throws, or a knot slips out.... and then it rips your finger off.

But with a gun, that risk spreads to everyone around you"," No amount of safeties and procedures are going to reduce the risk of injury and death a gun creates\~\~. You cannot procedure your way out of that.\~\~

**Edit:  Sorry, I sent the entirely wrong message here. no amount of safety procedures reduce the risk of injury and death a gun creates to zero. Gun safety procedures are important. But it needs to be understood that a gun ALWAYS carries a risk of injury or death no matter what you do.**

It's like using a tablesaw in the workplace. If you are interacting with the tool, there's a chance it throws, or a knot slips out.... and then it rips your finger off.

But with a gun, that risk spreads to everyone around you",4,,2025-01-20 00:28:13,t3_1i5danm,,https://www.reddit.com/r/confession/comments/1i5danm/nd_negligent_discharge_i_shot_my_truck_usa_gun/m82uoh7/,Neutral
19997,m832klc,comment,,"If you live by the sword you die by the sword. My dad was killed by an idiot with a gun, when I was two. Owning a gun means at anytime now the gun is present there is a possibility of a gun related accident. The no 1 reason for children’s death every year in the US is gun related deaths. You thought you were capable of owning a firearm and proved you are not worthy. You don’t take it seriously. Guns are weapons of death and every moment with a weapon is a life and death situation. If you believe in God see it as a sign and sell your weapons before you kill somebody."," If you live by the sword you die by the sword. My dad was killed by an idiot with a gun, when I was two. Owning a gun means at anytime now the gun is present there is a possibility of a gun related accident. The no 1 reason for children’s death every year in the US is gun related deaths. You thought you were capable of owning a firearm and proved you are not worthy. You don’t take it seriously. Guns are weapons of death and every moment with a weapon is a life and death situation. If you believe in God see it as a sign and sell your weapons before you kill somebody.",0,,2025-01-20 01:10:03,t3_1i5danm,,https://www.reddit.com/r/confession/comments/1i5danm/nd_negligent_discharge_i_shot_my_truck_usa_gun/m832klc/,Neutral
19998,m82z478,comment,,Probably someone put a round in it.   That happens a lot when you let people around weapons.   Had a friend load a hand gun they had been foolishly playing fake Russian roulette with.  The guy loaded it and the other guy came back from the toilet. He handed it to him and he apparently spun it and pointed it at the guy who loaded it.   Took him out.    I was not at the party as I alway make people put weapons up as booze and weapons are a dangerous mix.  Knew both of them.   What a mess    Glad nobody was hurt including you with your incident, Probably someone put a round in it.   That happens a lot when you let people around weapons.   Had a friend load a hand gun they had been foolishly playing fake Russian roulette with.  The guy loaded it and the other guy came back from the toilet. He handed it to him and he apparently spun it and pointed it at the guy who loaded it.   Took him out.    I was not at the party as I alway make people put weapons up as booze and weapons are a dangerous mix.  Knew both of them.   What a mess    Glad nobody was hurt including you with your incident,0,,2025-01-20 00:51:34,t3_1i5danm,,https://www.reddit.com/r/confession/comments/1i5danm/nd_negligent_discharge_i_shot_my_truck_usa_gun/m82z478/,Neutral
19999,m82xyfa,comment,,Yea I plan on taking it apart soon, Yea I plan on taking it apart soon,1,,2025-01-20 00:45:26,t1_m82xhyi,,https://www.reddit.com/r/confession/comments/1i5danm/nd_negligent_discharge_i_shot_my_truck_usa_gun/m82xyfa/,Neutral
20000,m8327cq,comment,,"As context, I always load a round into all my guns and then immediately eject the round to make sure the extractor is still functional and to make sure there is no sticking or odd sounds. 

Yes I'm aware this sounds stupid but this incident is the only time it has (no pun intended) back fired on me"," As context, I always load a round into all my guns and then immediately eject the round to make sure the extractor is still functional and to make sure there is no sticking or odd sounds. 

Yes I'm aware this sounds stupid but this incident is the only time it has (no pun intended) back fired on me",0,,2025-01-20 01:08:01,t1_m831o9q,,https://www.reddit.com/r/confession/comments/1i5danm/nd_negligent_discharge_i_shot_my_truck_usa_gun/m8327cq/,Neutral
20001,m836iq7,comment,,Always willing to learn and gain experience so not a bad idea, Always willing to learn and gain experience so not a bad idea,1,,2025-01-20 01:32:03,t1_m835kuo,,https://www.reddit.com/r/confession/comments/1i5danm/nd_negligent_discharge_i_shot_my_truck_usa_gun/m836iq7/,Neutral
