Unnamed: 0,id,type,title,content,text,score,num_comments,created_utc,parent_id,sentiment,url,label
18750,m85172v,comment,,"Both me and my mom have had this exact struggle. My mom has curly hair and I used to have very long hair. My mom cuts her own hair, which works for her but that won't work for me because my hair is wavy. It does need to be shaped

I wish I had advice, I'm just out here risking my whole life every time I go to a salon. I go so rarely that I've never really had a ""person"""," Both me and my mom have had this exact struggle. My mom has curly hair and I used to have very long hair. My mom cuts her own hair, which works for her but that won't work for me because my hair is wavy. It does need to be shaped

I wish I had advice, I'm just out here risking my whole life every time I go to a salon. I go so rarely that I've never really had a ""person""",1,,2025-01-20 10:14,t3_1i5jjsd,,https://www.reddit.com/r/offmychest/comments/1i5jjsd/i_walked_out_with_a_free_haircut_today_because/m85172v/,Neutral
18751,m84qgf0,comment,,this sounds more like you should get your sister at home to cut off 2 inches with a pair of scissors and a ruler if you're going to be that stingy about 2 inches., this sounds more like you should get your sister at home to cut off 2 inches with a pair of scissors and a ruler if you're going to be that stingy about 2 inches.,-8,,2025-01-20 8:20,t3_1i5jjsd,,https://www.reddit.com/r/offmychest/comments/1i5jjsd/i_walked_out_with_a_free_haircut_today_because/m84qgf0/,Neutral
18752,m84l6pa,comment,,So I get that she shouldn't have ignored what you asked like that but the fact that your have done this more than once and recorded discreetly seems like you are a Karen just being petty and forcing people to give you free shit., So I get that she shouldn't have ignored what you asked like that but the fact that your have done this more than once and recorded discreetly seems like you are a Karen just being petty and forcing people to give you free shit.,-16,,2025-01-20 7:27,t3_1i5jjsd,,https://www.reddit.com/r/offmychest/comments/1i5jjsd/i_walked_out_with_a_free_haircut_today_because/m84l6pa/,Neutral
18753,m84whak,comment,,"Thanks for all the great tips! Will put to use, and all in a positive spirit,  as opposed to catch someone out"," Thanks for all the great tips! Will put to use, and all in a positive spirit,  as opposed to catch someone out",16,,2025-01-20 9:24,t1_m84p73o,,https://www.reddit.com/r/offmychest/comments/1i5jjsd/i_walked_out_with_a_free_haircut_today_because/m84whak/,Neutral
18754,m851fta,comment,,"When I get my hair cut, I have to take off my glasses and I am approaching legally blind without my glasses so I absolutely cannot see in the mirror and am placing my entire faith in my hairdresser.

Recently, I asked for my hair to be cut to my shoulders and for my bangs to be trimmed straight across. When she was done cutting, I put on my glasses and she says ""I thought it would look better if we went shorter than your shoulders and gave you side swept bangs!"" So my hair is a good 2+ inches shorter than I wanted and now it doesn't fit in a ponytail, which I explicitly told her I needed it to. And my bangs don't really cover my forehead like I prefer them too.

Unfortunately I don't do well with confrontation so I just paid and went to cry from frustration briefly in my car. It's definitely not the first time a stylist hasn't listened to me :("," When I get my hair cut, I have to take off my glasses and I am approaching legally blind without my glasses so I absolutely cannot see in the mirror and am placing my entire faith in my hairdresser.

Recently, I asked for my hair to be cut to my shoulders and for my bangs to be trimmed straight across. When she was done cutting, I put on my glasses and she says ""I thought it would look better if we went shorter than your shoulders and gave you side swept bangs!"" So my hair is a good 2+ inches shorter than I wanted and now it doesn't fit in a ponytail, which I explicitly told her I needed it to. And my bangs don't really cover my forehead like I prefer them too.

Unfortunately I don't do well with confrontation so I just paid and went to cry from frustration briefly in my car. It's definitely not the first time a stylist hasn't listened to me :(",28,,2025-01-20 10:17,t1_m84gtye,,https://www.reddit.com/r/offmychest/comments/1i5jjsd/i_walked_out_with_a_free_haircut_today_because/m851fta/,Neutral
18755,m84r15q,comment,,"I don't know... when someone pulls their phone out when *you're* at work and declares they're going to record, what is your reaction?   The reaction is: oh, this person is crazy, I'm not going to serve them.  Someone recording you always feels like an act of aggression and suspicion, and is bad way to start any transaction."," I don't know... when someone pulls their phone out when *you're* at work and declares they're going to record, what is your reaction?   The reaction is: oh, this person is crazy, I'm not going to serve them.  Someone recording you always feels like an act of aggression and suspicion, and is bad way to start any transaction.",154,,2025-01-20 8:26,t1_m84ez4o,,https://www.reddit.com/r/offmychest/comments/1i5jjsd/i_walked_out_with_a_free_haircut_today_because/m84r15q/,Neutral
18756,m84j3jo,comment,,"I used to have hair down to my waist. The woman I went to a few times to thread my eyebrows was obsessed with convincing me to get a haircut. My mom (trained hairdresser) did all my trims for me so there was no need to get my hair cut there. I got bad vibes and pictured her chopping my hair right off so after the third time, I never went back.

Funnily enough, 10 years later I did cut my hair right off into a pixie 🤣"," I used to have hair down to my waist. The woman I went to a few times to thread my eyebrows was obsessed with convincing me to get a haircut. My mom (trained hairdresser) did all my trims for me so there was no need to get my hair cut there. I got bad vibes and pictured her chopping my hair right off so after the third time, I never went back.

Funnily enough, 10 years later I did cut my hair right off into a pixie 🤣",51,,2025-01-20 7:08,t1_m84dn6j,,https://www.reddit.com/r/offmychest/comments/1i5jjsd/i_walked_out_with_a_free_haircut_today_because/m84j3jo/,Neutral
18757,m84osr4,comment,,"Same.

I once had a hairdresser tell me that she wanted to cut all my hair off as soon as she saw me come into the salon 😳😳😳. She said this as I was sitting in the chair with her trimming my hair..."," Same.

I once had a hairdresser tell me that she wanted to cut all my hair off as soon as she saw me come into the salon 😳😳😳. She said this as I was sitting in the chair with her trimming my hair...",20,,2025-01-20 8:03,t1_m84dn6j,,https://www.reddit.com/r/offmychest/comments/1i5jjsd/i_walked_out_with_a_free_haircut_today_because/m84osr4/,Neutral
18758,m84wnbi,comment,,"More people need to record and say its not what I asked for so I am not paying, if they argue say, then you should go been a professional and only cut what was asked if you continue to complain i will call the police as cutting my hair without consent is assault and you cut more than I asked ergo assault, if you get funny i get funny, enough people do that, they won't do it anymore, you hired them to do a job they didn't do the job they did something else why should they get paid for something you don't want"," More people need to record and say its not what I asked for so I am not paying, if they argue say, then you should go been a professional and only cut what was asked if you continue to complain i will call the police as cutting my hair without consent is assault and you cut more than I asked ergo assault, if you get funny i get funny, enough people do that, they won't do it anymore, you hired them to do a job they didn't do the job they did something else why should they get paid for something you don't want",-2,,2025-01-20 9:25,t1_m84r9tu,,https://www.reddit.com/r/offmychest/comments/1i5jjsd/i_walked_out_with_a_free_haircut_today_because/m84wnbi/,Neutral
18759,m84wpbq,comment,,"So what, that doesn't give them the right to do it, nor should they without consent"," So what, that doesn't give them the right to do it, nor should they without consent",7,,2025-01-20 9:26,t1_m84tllm,,https://www.reddit.com/r/offmychest/comments/1i5jjsd/i_walked_out_with_a_free_haircut_today_because/m84wpbq/,Neutral
18760,m855f88,comment,,"When my son was born (with a lot of hair) I was *very* unhappy with the service he got at the local hairsalon. I learned to cut his hair (from a book) and surprisingly, it is **way less difficult** than hairdressers make you believe, especially because I only needed to learn 1 cut. I don't cut different hair all day, just his hair, same style again and again.

You might have succes asking your mom cutting your hair."," When my son was born (with a lot of hair) I was *very* unhappy with the service he got at the local hairsalon. I learned to cut his hair (from a book) and surprisingly, it is **way less difficult** than hairdressers make you believe, especially because I only needed to learn 1 cut. I don't cut different hair all day, just his hair, same style again and again.

You might have succes asking your mom cutting your hair.",2,,2025-01-20 10:58,t1_m85172v,,https://www.reddit.com/r/offmychest/comments/1i5jjsd/i_walked_out_with_a_free_haircut_today_because/m855f88/,Neutral
18761,m8513ok,comment,,It just happens to often. People can only get screwed over so many times before enough is enough., It just happens to often. People can only get screwed over so many times before enough is enough.,2,,2025-01-20 10:13,t1_m84zlxw,,https://www.reddit.com/r/offmychest/comments/1i5jjsd/i_walked_out_with_a_free_haircut_today_because/m8513ok/,Neutral
18762,m84usk8,comment,,You should be asking the hairdresser why her ego and opinion are so important that she feels it's OK risking getting fired., You should be asking the hairdresser why her ego and opinion are so important that she feels it's OK risking getting fired.,6,,2025-01-20 9:06,t1_m84nid9,,https://www.reddit.com/r/offmychest/comments/1i5jjsd/i_walked_out_with_a_free_haircut_today_because/m84usk8/,Neutral
18763,m84p4cg,comment,,"That's absolute bullshit. 

The hairdresser knew exactly what she was doing."," That's absolute bullshit. 

The hairdresser knew exactly what she was doing.",7,,2025-01-20 8:06,t1_m84nid9,,https://www.reddit.com/r/offmychest/comments/1i5jjsd/i_walked_out_with_a_free_haircut_today_because/m84p4cg/,Neutral
18764,m84wvle,comment,,"That gives them the right to trample over peoples wishes and then charge them for it, no, if someone is bad at their job, children or not, they get fired, you are the one missing the bigger picture not her"," That gives them the right to trample over peoples wishes and then charge them for it, no, if someone is bad at their job, children or not, they get fired, you are the one missing the bigger picture not her",3,,2025-01-20 9:28,t1_m84nid9,,https://www.reddit.com/r/offmychest/comments/1i5jjsd/i_walked_out_with_a_free_haircut_today_because/m84wvle/,Neutral
18765,m84oohp,comment,,"Yes, much more important. This is a business, they can refuse service if they so desire."," Yes, much more important. This is a business, they can refuse service if they so desire.",2,,2025-01-20 8:02,t1_m84nid9,,https://www.reddit.com/r/offmychest/comments/1i5jjsd/i_walked_out_with_a_free_haircut_today_because/m84oohp/,Neutral
18766,m852u9s,comment,,"Then they best not choose to behave so poorly that they lose jobs. It's called being a fucking adult and doing your job like you're supposed to. They don't get to be assholes and have everything handed to them just because they have kids. If you choose to fuck up someone's hair and you get fired, that's your fault."," Then they best not choose to behave so poorly that they lose jobs. It's called being a fucking adult and doing your job like you're supposed to. They don't get to be assholes and have everything handed to them just because they have kids. If you choose to fuck up someone's hair and you get fired, that's your fault.",1,,2025-01-20 10:31,t1_m84nid9,,https://www.reddit.com/r/offmychest/comments/1i5jjsd/i_walked_out_with_a_free_haircut_today_because/m852u9s/,Neutral
18767,m8516nr,comment,,That's not what OP asked for. OP paid to have some of the unhealthy hair left on not chopped off., That's not what OP asked for. OP paid to have some of the unhealthy hair left on not chopped off.,5,,2025-01-20 10:14,t1_m84uo1q,,https://www.reddit.com/r/offmychest/comments/1i5jjsd/i_walked_out_with_a_free_haircut_today_because/m8516nr/,Neutral
18768,m84x80q,comment,,"How is expecting her to respect your wishes and be a professional and holding her to that standard being a Karen? You arent exactly the brightest bulb if you think that's what a Karen is. 

A Karen would stick a hair in a meal and then record after that and act like the server was in the wrong, a Karen would lie and say they said 1 inch and the hair dresser did 6 inch and then only record the after not during for proof. Those are just two examples. 

Yes the hair cut should be free, she shouldn't have to pay for what she didn't ask for, that isn't being a Karen that's reasonable and people like you are as much an issue as people who do act like a ""Karen"""," How is expecting her to respect your wishes and be a professional and holding her to that standard being a Karen? You arent exactly the brightest bulb if you think that's what a Karen is. 

A Karen would stick a hair in a meal and then record after that and act like the server was in the wrong, a Karen would lie and say they said 1 inch and the hair dresser did 6 inch and then only record the after not during for proof. Those are just two examples. 

Yes the hair cut should be free, she shouldn't have to pay for what she didn't ask for, that isn't being a Karen that's reasonable and people like you are as much an issue as people who do act like a ""Karen""",6,,2025-01-20 9:32,t1_m84l6pa,,https://www.reddit.com/r/offmychest/comments/1i5jjsd/i_walked_out_with_a_free_haircut_today_because/m84x80q/,Neutral
18769,m84pe1v,comment,,"Sounds like you have never had extremely long hair.

Would you accept the same from a surgeon? ""Oh sorry, I know you only needed your pinky toe amputated, but we took the whole leg off""."," Sounds like you have never had extremely long hair.

Would you accept the same from a surgeon? ""Oh sorry, I know you only needed your pinky toe amputated, but we took the whole leg off"".",4,,2025-01-20 8:09,t1_m84l6pa,,https://www.reddit.com/r/offmychest/comments/1i5jjsd/i_walked_out_with_a_free_haircut_today_because/m84pe1v/,Neutral
18770,m854169,comment,,That's awful! I'm sorry that happened to you., That's awful! I'm sorry that happened to you.,4,,2025-01-20 10:44,t1_m851fta,,https://www.reddit.com/r/offmychest/comments/1i5jjsd/i_walked_out_with_a_free_haircut_today_because/m854169/,Neutral
18771,m84zgyc,comment,,"If you explain ""I've been f-ed over many times, so I'm recording this,"" it's different than ""I'm recording this because everyone's an ass""."," If you explain ""I've been f-ed over many times, so I'm recording this,"" it's different than ""I'm recording this because everyone's an ass"".",20,,2025-01-20 9:56,t1_m84r15q,,https://www.reddit.com/r/offmychest/comments/1i5jjsd/i_walked_out_with_a_free_haircut_today_because/m84zgyc/,Neutral
18772,m84kafw,comment,,"After my childhood stylist (surprisingly, my dad took me to a fancy salon as a kid) left, my dad - not a trained stylist - started cutting my hair. And he did better than my last 10 stylists!!! And while using crappy kitchen scissors!! 

I only get a cut once a year now because I'm so afraid of the uneveness. I have to go back every. Freaking. Time. I'm hoping to finally stay in one spot now, so maybe I'll find a go to stylist, but the last woman I saw missed a massive chunk of hair that I didn't see until I got home (she started styling it before I could check.)"," After my childhood stylist (surprisingly, my dad took me to a fancy salon as a kid) left, my dad - not a trained stylist - started cutting my hair. And he did better than my last 10 stylists!!! And while using crappy kitchen scissors!! 

I only get a cut once a year now because I'm so afraid of the uneveness. I have to go back every. Freaking. Time. I'm hoping to finally stay in one spot now, so maybe I'll find a go to stylist, but the last woman I saw missed a massive chunk of hair that I didn't see until I got home (she started styling it before I could check.)",28,,2025-01-20 7:19,t1_m84j3jo,,https://www.reddit.com/r/offmychest/comments/1i5jjsd/i_walked_out_with_a_free_haircut_today_because/m84kafw/,Neutral
18773,m850uri,comment,,"I don't know, I don't think that would change it for me, personally. I'm confident at my job, but I also have autism and I think it would make my brain start malfunctioning if someone said that to me. I do not think that I would be trustworthy with someone's hair, as I think that my nervousness would compromise my hands"," I don't know, I don't think that would change it for me, personally. I'm confident at my job, but I also have autism and I think it would make my brain start malfunctioning if someone said that to me. I do not think that I would be trustworthy with someone's hair, as I think that my nervousness would compromise my hands",13,,2025-01-20 10:10,t1_m84zgyc,,https://www.reddit.com/r/offmychest/comments/1i5jjsd/i_walked_out_with_a_free_haircut_today_because/m850uri/,Neutral
18774,m850cun,comment,,"Because no average employee just trying to make it through the week gets paid enough to deal with with some weirdo recording them. 

Almost every single experience at the salon as been lackluster to terrible.  You know what?  I'm nice, I tip, and if it's truly atrocious, I don't go back.  

When I harass normal people for taking a couple extra inches off my hair, I'm the one that loses.  I have high standards for the way I conduct myself and the way I treat people."," Because no average employee just trying to make it through the week gets paid enough to deal with with some weirdo recording them. 

Almost every single experience at the salon as been lackluster to terrible.  You know what?  I'm nice, I tip, and if it's truly atrocious, I don't go back.  

When I harass normal people for taking a couple extra inches off my hair, I'm the one that loses.  I have high standards for the way I conduct myself and the way I treat people.",1,,2025-01-20 10:05,t1_m84zgyc,,https://www.reddit.com/r/offmychest/comments/1i5jjsd/i_walked_out_with_a_free_haircut_today_because/m850cun/,Neutral
18775,m84jrxj,comment,,"Your boyfriend is an adult and should be able to defend himself. It’s hard to tell without the full context of the situation, but it kind of sounds like he might be using you “freezing up” as an excuse to isolate you.  He is not justified in being upset at you over the behavior of others, and it’s not your job to regulate his interactions. Frankly, he sounds like he might not be great for you! Also- per the intense feelings of guilt. Please be nicer to yourself!!!!"," Your boyfriend is an adult and should be able to defend himself. It’s hard to tell without the full context of the situation, but it kind of sounds like he might be using you “freezing up” as an excuse to isolate you.  He is not justified in being upset at you over the behavior of others, and it’s not your job to regulate his interactions. Frankly, he sounds like he might not be great for you! Also- per the intense feelings of guilt. Please be nicer to yourself!!!!",1,,2025-01-20 7:14,t3_1i5ja64,,https://www.reddit.com/r/offmychest/comments/1i5ja64/i_keep_fucking_everything_up/m84jrxj/,Neutral
18776,m846etk,comment,,Everything will be okay ! When ur in ur 20s that’s when u fail the most bc ur still getting ur life together! It always falls apart before it becomes the life you want ! Anyways I just mean it happens for a reason yk !, Everything will be okay ! When ur in ur 20s that’s when u fail the most bc ur still getting ur life together! It always falls apart before it becomes the life you want ! Anyways I just mean it happens for a reason yk !,1,,2025-01-20 5:19,t3_1i5is36,,https://www.reddit.com/r/offmychest/comments/1i5is36/idk_what_to_do/m846etk/,Neutral
18777,m857mnk,comment,,">Wish me luck, I guess. What a crazy rollercoaster life is! 

It really is! And honestly I wouldn't care about the age gap, I feel like this subject has been excessively villified on social media and reddit in particular to a ridiculous degree. 

Also, depends on how assertive the guy is in this regard, but it might be worth it to drop some unsubtle hints, or just go for it yourself."," >Wish me luck, I guess. What a crazy rollercoaster life is! 

It really is! And honestly I wouldn't care about the age gap, I feel like this subject has been excessively villified on social media and reddit in particular to a ridiculous degree. 

Also, depends on how assertive the guy is in this regard, but it might be worth it to drop some unsubtle hints, or just go for it yourself.",1,,2025-01-20 11:20,t3_1i5inz2,,https://www.reddit.com/r/offmychest/comments/1i5inz2/im_28f_crushing_on_my_much_older_friend_42m_what/m857mnk/,Neutral
18778,m83rgaz,comment,,"I'm sorry this happened to you, but they showed you who they are and what values they have. Now it's time to start fresh and find friends that see your worth and make your life better for having their positive influence in it."," I'm sorry this happened to you, but they showed you who they are and what values they have. Now it's time to start fresh and find friends that see your worth and make your life better for having their positive influence in it.",2,,2025-01-20 3:33,t3_1i5gyw4,,https://www.reddit.com/r/offmychest/comments/1i5gyw4/i_lost_all_my_friends_because_i_hated_my_friends/m83rgaz/,Neutral
18779,m83ld5b,comment,,"Girl, he sounds like me, but you should leave him… he needs to learn how to look after himself"," Girl, he sounds like me, but you should leave him… he needs to learn how to look after himself",1,,2025-01-20 2:54,t3_1i5gdux,,https://www.reddit.com/r/offmychest/comments/1i5gdux/i_just_hate_my_life_rn/m83ld5b/,Neutral
18780,m83kwhv,comment,,"It’s a deal breaker. Have a serious conversation about. There’s no middle ground in this so if y’all are still at odds on children, end it. Prolonging the inevitable or stringing the other along would be cruel."," It’s a deal breaker. Have a serious conversation about. There’s no middle ground in this so if y’all are still at odds on children, end it. Prolonging the inevitable or stringing the other along would be cruel.",259,,2025-01-20 2:52,t3_1i5fywv,,https://www.reddit.com/r/offmychest/comments/1i5fywv/well_today_i_think_my_dreams_of_a_family_were/m83kwhv/,Neutral
18781,m83kjoc,comment,,"Kids are one thing that is not negotiable.   If one wants kids and the other doesn't,  one of you is going to be unhappy.

Edited to add... this is something you need to have a broader conversation over to see if you are compatible."," Kids are one thing that is not negotiable.   If one wants kids and the other doesn't,  one of you is going to be unhappy.

Edited to add... this is something you need to have a broader conversation over to see if you are compatible.",225,,2025-01-20 2:50,t3_1i5fywv,,https://www.reddit.com/r/offmychest/comments/1i5fywv/well_today_i_think_my_dreams_of_a_family_were/m83kjoc/,Neutral
18782,m84232f,comment,,"Imagine telling your partner of 5 years your biggest hopes and dreams and then they respond with “chill, keep that to yourself.” Like that’s some shit you say to a stranger sitting next to you on the bus that’s oversharing, not the partner you have dedicated half a decade to. Honestly that attitude alone would make me consider breaking up regardless of the subject matter."," Imagine telling your partner of 5 years your biggest hopes and dreams and then they respond with “chill, keep that to yourself.” Like that’s some shit you say to a stranger sitting next to you on the bus that’s oversharing, not the partner you have dedicated half a decade to. Honestly that attitude alone would make me consider breaking up regardless of the subject matter.",119,,2025-01-20 4:46,t3_1i5fywv,,https://www.reddit.com/r/offmychest/comments/1i5fywv/well_today_i_think_my_dreams_of_a_family_were/m84232f/,Neutral
18783,m83zwjd,comment,,"Married childfree woman in my late 50’s here.  This is a dealbreaker hon, sorry."," Married childfree woman in my late 50’s here.  This is a dealbreaker hon, sorry.",27,,2025-01-20 4:30,t3_1i5fywv,,https://www.reddit.com/r/offmychest/comments/1i5fywv/well_today_i_think_my_dreams_of_a_family_were/m83zwjd/,Neutral
18784,m83jmt7,comment,,"That’s really tough, I’m sorry. 

She is allowed to change her mind, but I don’t think she handling telling you very well. That must have been really hard to hear, surprising even. 

Does she understand what this means for your relationship?"," That’s really tough, I’m sorry. 

She is allowed to change her mind, but I don’t think she handling telling you very well. That must have been really hard to hear, surprising even. 

Does she understand what this means for your relationship?",53,,2025-01-20 2:44,t3_1i5fywv,,https://www.reddit.com/r/offmychest/comments/1i5fywv/well_today_i_think_my_dreams_of_a_family_were/m83jmt7/,Neutral
