Unnamed: 0,id,type,title,content,text,score,num_comments,created_utc,parent_id,sentiment,url,label
20105,m7xw3l3,comment,,"I will be messaging you in 1 year on [**2026-01-19 06:17:12 UTC**](http://www.wolframalpha.com/input/?i=2026-01-19%2006:17:12%20UTC%20To%20Local%20Time) to remind you of [**this link**](https://www.reddit.com/r/confession/comments/1i4plfm/i_lied_for_12_years_about_my_identity_but_theres/m7xw152/?context=3)

[**6 OTHERS CLICKED THIS LINK**](https://www.reddit.com/message/compose/?to=RemindMeBot&subject=Reminder&message=%5Bhttps%3A%2F%2Fwww.reddit.com%2Fr%2Fconfession%2Fcomments%2F1i4plfm%2Fi_lied_for_12_years_about_my_identity_but_theres%2Fm7xw152%2F%5D%0A%0ARemindMe%21%202026-01-19%2006%3A17%3A12%20UTC) to send a PM to also be reminded and to reduce spam.

^(Parent commenter can ) [^(delete this message to hide from others.)](https://www.reddit.com/message/compose/?to=RemindMeBot&subject=Delete%20Comment&message=Delete%21%201i4plfm)

*****

|[^(Info)](https://www.reddit.com/r/RemindMeBot/comments/e1bko7/remindmebot_info_v21/)|[^(Custom)](https://www.reddit.com/message/compose/?to=RemindMeBot&subject=Reminder&message=%5BLink%20or%20message%20inside%20square%20brackets%5D%0A%0ARemindMe%21%20Time%20period%20here)|[^(Your Reminders)](https://www.reddit.com/message/compose/?to=RemindMeBot&subject=List%20Of%20Reminders&message=MyReminders%21)|[^(Feedback)](https://www.reddit.com/message/compose/?to=Watchful1&subject=RemindMeBot%20Feedback)|
|-|-|-|-|"," I will be messaging you in 1 year on [**2026-01-19 06:17:12 UTC**](http://www.wolframalpha.com/input/?i=2026-01-19%2006:17:12%20UTC%20To%20Local%20Time) to remind you of [**this link**](https://www.reddit.com/r/confession/comments/1i4plfm/i_lied_for_12_years_about_my_identity_but_theres/m7xw152/?context=3)

[**6 OTHERS CLICKED THIS LINK**](https://www.reddit.com/message/compose/?to=RemindMeBot&subject=Reminder&message=%5Bhttps%3A%2F%2Fwww.reddit.com%2Fr%2Fconfession%2Fcomments%2F1i4plfm%2Fi_lied_for_12_years_about_my_identity_but_theres%2Fm7xw152%2F%5D%0A%0ARemindMe%21%202026-01-19%2006%3A17%3A12%20UTC) to send a PM to also be reminded and to reduce spam.

^(Parent commenter can ) [^(delete this message to hide from others.)](https://www.reddit.com/message/compose/?to=RemindMeBot&subject=Delete%20Comment&message=Delete%21%201i4plfm)

*****

|[^(Info)](https://www.reddit.com/r/RemindMeBot/comments/e1bko7/remindmebot_info_v21/)|[^(Custom)](https://www.reddit.com/message/compose/?to=RemindMeBot&subject=Reminder&message=%5BLink%20or%20message%20inside%20square%20brackets%5D%0A%0ARemindMe%21%20Time%20period%20here)|[^(Your Reminders)](https://www.reddit.com/message/compose/?to=RemindMeBot&subject=List%20Of%20Reminders&message=MyReminders%21)|[^(Feedback)](https://www.reddit.com/message/compose/?to=Watchful1&subject=RemindMeBot%20Feedback)|
|-|-|-|-|",2,,2025-01-19 06:17:45,t1_m7xw152,,https://www.reddit.com/r/confession/comments/1i4plfm/i_lied_for_12_years_about_my_identity_but_theres/m7xw3l3/,Neutral
20106,m7xllo1,comment,,Thank you so much for the kind words, Thank you so much for the kind words,3,,2025-01-19 05:04:39,t1_m7xl7jf,,https://www.reddit.com/r/confession/comments/1i4plfm/i_lied_for_12_years_about_my_identity_but_theres/m7xllo1/,Neutral
20107,m81hhg6,comment,,"I feel I do too. However, I cannot force him to tell me. Everything we communicated through, he deactivated. It feels like I fell in love with a ghost and I’m trying to reassure myself that my feelings are valid, that this is real, that it is okay to be sobbing all day. I know there must be a reason. I am just praying that God will show me one day. I am praying that this guy may give me the closure one day, but if he doesn’t, then I have to figure out how to move forward and heal either way."," I feel I do too. However, I cannot force him to tell me. Everything we communicated through, he deactivated. It feels like I fell in love with a ghost and I’m trying to reassure myself that my feelings are valid, that this is real, that it is okay to be sobbing all day. I know there must be a reason. I am just praying that God will show me one day. I am praying that this guy may give me the closure one day, but if he doesn’t, then I have to figure out how to move forward and heal either way.",1,,2025-01-19 20:22:26,t1_m81h12i,,https://www.reddit.com/r/confession/comments/1i4plfm/i_lied_for_12_years_about_my_identity_but_theres/m81hhg6/,Neutral
20108,m82ssem,comment,,"He may be. Who knows? I just wish I had closure. It feels so weird not knowing. But he decided to leave, and I have to let him. It can only get better from here since I am at rock bottom."," He may be. Who knows? I just wish I had closure. It feels so weird not knowing. But he decided to leave, and I have to let him. It can only get better from here since I am at rock bottom.",1,,2025-01-20 00:18:09,t1_m82nkf8,,https://www.reddit.com/r/confession/comments/1i4plfm/i_lied_for_12_years_about_my_identity_but_theres/m82ssem/,Neutral
20109,m854cr3,comment,,"I took screenshot and asked for summary from meta AI :
Here's a revised summary:

The author met a man online 12 years ago, and they formed a deep connection, becoming best friends and eventually falling in love. However, they both hid their true identities, sending fake photos and using pseudonyms. After 12 years, the author confessed the truth, and the man revealed he had also been lying. Despite this, he chose to end their relationship, citing too much hurt and pain. The author is now grappling with feelings of guilt, shock, and devastation.

According to the story, both individuals faked:

1. Their photos: They sent each other fake photos, pretending to be someone else.

2. Their identities: They hid their real names and identities from each other."," I took screenshot and asked for summary from meta AI :
Here's a revised summary:

The author met a man online 12 years ago, and they formed a deep connection, becoming best friends and eventually falling in love. However, they both hid their true identities, sending fake photos and using pseudonyms. After 12 years, the author confessed the truth, and the man revealed he had also been lying. Despite this, he chose to end their relationship, citing too much hurt and pain. The author is now grappling with feelings of guilt, shock, and devastation.

According to the story, both individuals faked:

1. Their photos: They sent each other fake photos, pretending to be someone else.

2. Their identities: They hid their real names and identities from each other.",1,,2025-01-20 10:47:40,t1_m853gut,,https://www.reddit.com/r/confession/comments/1i4plfm/i_lied_for_12_years_about_my_identity_but_theres/m854cr3/,Neutral
20110,m7xl4uu,comment,,"You deserve your answers. To me it sounds like this guy is hiding something and choosing to blame you “my heart is broken, we can’t continue, I’m too hurt”. Bullshit."," You deserve your answers. To me it sounds like this guy is hiding something and choosing to blame you “my heart is broken, we can’t continue, I’m too hurt”. Bullshit.",28,,2025-01-19 05:01:43,t1_m7xkrwi,,https://www.reddit.com/r/confession/comments/1i4plfm/i_lied_for_12_years_about_my_identity_but_theres/m7xl4uu/,Neutral
20111,m7xtkei,comment,,I went through something SO extremely similar. I never used someone else’s pictures tho. We talked for years and he never sent me his actual phone number. I still don’t know to this day if the photos he sent me were of him. It feels so odd because I feel like I will never know the truth. What’s messed up is he still has access to me if he ever wanted it but I can never find him because I don’t think he was ever fully truthful with me. If you want someone to talk to about his you can message me anytime., I went through something SO extremely similar. I never used someone else’s pictures tho. We talked for years and he never sent me his actual phone number. I still don’t know to this day if the photos he sent me were of him. It feels so odd because I feel like I will never know the truth. What’s messed up is he still has access to me if he ever wanted it but I can never find him because I don’t think he was ever fully truthful with me. If you want someone to talk to about his you can message me anytime.,3,,2025-01-19 05:58:34,t1_m7xkrwi,,https://www.reddit.com/r/confession/comments/1i4plfm/i_lied_for_12_years_about_my_identity_but_theres/m7xtkei/,Neutral
20112,m7xyo8v,comment,,Oh my gosh. I am so sorry you went through this. This is so hard. I will message you. It is crazy but somewhat comforting to know others have been in similar situations. It makes me feel not as alone in this. Thank you for sharing and I hope you are doing better ❤️, Oh my gosh. I am so sorry you went through this. This is so hard. I will message you. It is crazy but somewhat comforting to know others have been in similar situations. It makes me feel not as alone in this. Thank you for sharing and I hope you are doing better ❤️,2,,2025-01-19 06:38:44,t1_m7xs150,,https://www.reddit.com/r/confession/comments/1i4plfm/i_lied_for_12_years_about_my_identity_but_theres/m7xyo8v/,Neutral
20113,m7yq77d,comment,,"As someone who used to lie about their identity and age I can say choice can be deceiving. People hear my voice and could miss my real age by a decade or more. But the study part sounds convincing. So my guess is: he loved you but he moved in with his life. After the first break up he found someone and he's in a relationship. He still loves you but he gave up and he doesn't want to throw away his real relationship, even if he still has feelings for you. These new pictures are fake too because he doesn't want to be tracked, that could potentially ruin his life. As he said ""it's too late"". And I don't blame him. I ruined an ok real relationship for a ""perfect"" long distance online relationship and it was the worst decision of my life. Just keep your food memories and move on."," As someone who used to lie about their identity and age I can say choice can be deceiving. People hear my voice and could miss my real age by a decade or more. But the study part sounds convincing. So my guess is: he loved you but he moved in with his life. After the first break up he found someone and he's in a relationship. He still loves you but he gave up and he doesn't want to throw away his real relationship, even if he still has feelings for you. These new pictures are fake too because he doesn't want to be tracked, that could potentially ruin his life. As he said ""it's too late"". And I don't blame him. I ruined an ok real relationship for a ""perfect"" long distance online relationship and it was the worst decision of my life. Just keep your food memories and move on.",3,,2025-01-19 11:08:03,t1_m7y6fl4,,https://www.reddit.com/r/confession/comments/1i4plfm/i_lied_for_12_years_about_my_identity_but_theres/m7yq77d/,Neutral
20114,m823h5l,comment,,"Part of what you mentioned was his  high school friend and how you would approach such a situation (conversation) if you touched base. 

Your post describes things really well and how this relates (connects the dots). 

It might be worth considering reaching out and pointing him to this post and see what kind of response you get by return. 

Don’t give your forwarding address or anything but an email/app he can reach you on should he/she wishes too. 

It is one avenue explored. 

With all other forms of contact discontinued (blocked) it limits anything further you can do to find a reason behind his actions. 

I am not saying stalk or anything but just for the closure. 

Who knows! He may reach out again in the near future once he has had time to process everything. You will be on his mind equally…"," Part of what you mentioned was his  high school friend and how you would approach such a situation (conversation) if you touched base. 

Your post describes things really well and how this relates (connects the dots). 

It might be worth considering reaching out and pointing him to this post and see what kind of response you get by return. 

Don’t give your forwarding address or anything but an email/app he can reach you on should he/she wishes too. 

It is one avenue explored. 

With all other forms of contact discontinued (blocked) it limits anything further you can do to find a reason behind his actions. 

I am not saying stalk or anything but just for the closure. 

Who knows! He may reach out again in the near future once he has had time to process everything. You will be on his mind equally…",1,,2025-01-19 22:06:49,t1_m81hhg6,,https://www.reddit.com/r/confession/comments/1i4plfm/i_lied_for_12_years_about_my_identity_but_theres/m823h5l/,Neutral
20115,m81842h,comment,,"Sometimes, closure is overrated. He isn't communicating with you. When people break up, they don't contact each other. I wouldn't dwell on lying. He did the exact same thing, BUT never told you. You both made mistakes, it happens. If you could delve into a hobby or group of friends so you can stop thinking about him. Time will heal, trust me."," Sometimes, closure is overrated. He isn't communicating with you. When people break up, they don't contact each other. I wouldn't dwell on lying. He did the exact same thing, BUT never told you. You both made mistakes, it happens. If you could delve into a hobby or group of friends so you can stop thinking about him. Time will heal, trust me.",2,,2025-01-19 19:36:51,t1_m816mdi,,https://www.reddit.com/r/confession/comments/1i4plfm/i_lied_for_12_years_about_my_identity_but_theres/m81842h/,Neutral
20116,m7xlf5w,comment,,"Thank you. I have so much guilt. I don’t know what I deserve anymore. I did so many things wrong as did he. But yes, I wish I had answers. I have no way of reaching out anymore though. I guess it is time for me to move forward 💔"," Thank you. I have so much guilt. I don’t know what I deserve anymore. I did so many things wrong as did he. But yes, I wish I had answers. I have no way of reaching out anymore though. I guess it is time for me to move forward 💔",7,,2025-01-19 05:03:31,t1_m7xl4uu,,https://www.reddit.com/r/confession/comments/1i4plfm/i_lied_for_12_years_about_my_identity_but_theres/m7xlf5w/,Neutral
20117,m7y5fn8,comment,,👆🏼this person gets it., 👆🏼this person gets it.,5,,2025-01-19 07:39:39,t1_m7xl4uu,,https://www.reddit.com/r/confession/comments/1i4plfm/i_lied_for_12_years_about_my_identity_but_theres/m7y5fn8/,Neutral
20118,m80x7de,comment,,"I know its hard! But you got this 🙌
Glad I could somewhat give you comfort. It is a crazy situation and it's been a massive part of my life so I KNOW how difficult it's gonna be for you to move on.. just wanted you to not feel so alone in all this. And to have someone somewhat understand your heartache, to give you comfort in your healing process. 

I really hope you can get closure xx"," I know its hard! But you got this 🙌
Glad I could somewhat give you comfort. It is a crazy situation and it's been a massive part of my life so I KNOW how difficult it's gonna be for you to move on.. just wanted you to not feel so alone in all this. And to have someone somewhat understand your heartache, to give you comfort in your healing process. 

I really hope you can get closure xx",1,,2025-01-19 18:45:17,t1_m7xyo8v,,https://www.reddit.com/r/confession/comments/1i4plfm/i_lied_for_12_years_about_my_identity_but_theres/m80x7de/,Neutral
20119,m7yadzj,comment,,"Yah OP, something doesn’t smell right here. He “was gonna tell you in person”? But now that it’s come out online he ghosts? He is either a massive hypocrite OR he is still lying. My guess is the photos he sent you recently aren’t him either.

And I hate to tell you this but I’m gonna he blunt… you didn’t love each other. You were both lying to each other. You cannot love when there’s no honesty. You became attached to the fabrication of one another. 

Also, for all you know this guy was a psycho, creating stories that made him appear to be your dream guy. Agreeing with you about things you said were important to you. Manufacturing pain to garner sympathy. Pretending to share the same passions and values, etc. You cannot know that anything he told you was true, you literally NEVER met him… you never even heard his voice. How could you gauge if he was being truthful? Yes, he might’ve been being genuine… but he was already lying to you, and then weirdly wouldn’t forgive you for the exact same thing… 

I dunno. It’s fishy. But please just remember, you didn’t love *him* you loved what you thought he was. The fabricated version you created in your head. Because you never even knew the real person."," Yah OP, something doesn’t smell right here. He “was gonna tell you in person”? But now that it’s come out online he ghosts? He is either a massive hypocrite OR he is still lying. My guess is the photos he sent you recently aren’t him either.

And I hate to tell you this but I’m gonna he blunt… you didn’t love each other. You were both lying to each other. You cannot love when there’s no honesty. You became attached to the fabrication of one another. 

Also, for all you know this guy was a psycho, creating stories that made him appear to be your dream guy. Agreeing with you about things you said were important to you. Manufacturing pain to garner sympathy. Pretending to share the same passions and values, etc. You cannot know that anything he told you was true, you literally NEVER met him… you never even heard his voice. How could you gauge if he was being truthful? Yes, he might’ve been being genuine… but he was already lying to you, and then weirdly wouldn’t forgive you for the exact same thing… 

I dunno. It’s fishy. But please just remember, you didn’t love *him* you loved what you thought he was. The fabricated version you created in your head. Because you never even knew the real person.",12,,2025-01-19 08:27:53,t1_m7xlf5w,,https://www.reddit.com/r/confession/comments/1i4plfm/i_lied_for_12_years_about_my_identity_but_theres/m7yadzj/,Neutral
20120,m80z9fz,comment,,"It is crazy. Right now, all I feel is lost, confused, and in so much shock that he disappeared. And I have no way to contact him because he deactivated his email too. So I have to move forward. It is very hard."," It is crazy. Right now, all I feel is lost, confused, and in so much shock that he disappeared. And I have no way to contact him because he deactivated his email too. So I have to move forward. It is very hard.",1,,2025-01-19 18:54:53,t1_m80x7de,,https://www.reddit.com/r/confession/comments/1i4plfm/i_lied_for_12_years_about_my_identity_but_theres/m80z9fz/,Neutral
20121,m7z182h,comment,,"Thank you for saying this. Yes, it is a shock to my system to even think that so many things were fabricated that way. Although I lied about my identity, I did not lie about anything else as far as what I did everyday, who I was with, where I worked, etc. I should’ve just been honest from the beginning, but I wonder if it would’ve hurt more to know I was honest and this whole time he still wasn’t. Maybe it was for the best."," Thank you for saying this. Yes, it is a shock to my system to even think that so many things were fabricated that way. Although I lied about my identity, I did not lie about anything else as far as what I did everyday, who I was with, where I worked, etc. I should’ve just been honest from the beginning, but I wonder if it would’ve hurt more to know I was honest and this whole time he still wasn’t. Maybe it was for the best.",2,,2025-01-19 12:48:01,t1_m7yadzj,,https://www.reddit.com/r/confession/comments/1i4plfm/i_lied_for_12_years_about_my_identity_but_theres/m7z182h/,Neutral
20122,m817839,comment,,"It makes me feel like maybe he isn't who he eventually confessed to be...?

Thats a lot to go through to avoid someone..  Especially as you did the same. Surely he should feel comfort in that?! Its so strange. I really feel for you! 

If there's anything I can do, please do not hesitate in letting me know! ❤️

You got this!"," It makes me feel like maybe he isn't who he eventually confessed to be...?

Thats a lot to go through to avoid someone..  Especially as you did the same. Surely he should feel comfort in that?! Its so strange. I really feel for you! 

If there's anything I can do, please do not hesitate in letting me know! ❤️

You got this!",1,,2025-01-19 19:32:35,t1_m80z9fz,,https://www.reddit.com/r/confession/comments/1i4plfm/i_lied_for_12_years_about_my_identity_but_theres/m817839/,Neutral
20123,m8003o8,comment,,"It’s absolutely for the best. You were holding onto an attachment that wasn’t real (and it probably affected your IRL relationships). Grieve what you thought it was and then move forward with your life. Don’t waste YEARS on someone without meeting them. If you cannot be yourself that person isn’t worth it. You may wanna look into therapy as well, this is obviously hurting you and you’ll wanna unpack it but also to work on your self esteem that would cause you to lie in the first place"," It’s absolutely for the best. You were holding onto an attachment that wasn’t real (and it probably affected your IRL relationships). Grieve what you thought it was and then move forward with your life. Don’t waste YEARS on someone without meeting them. If you cannot be yourself that person isn’t worth it. You may wanna look into therapy as well, this is obviously hurting you and you’ll wanna unpack it but also to work on your self esteem that would cause you to lie in the first place",1,,2025-01-19 16:10:25,t1_m7z182h,,https://www.reddit.com/r/confession/comments/1i4plfm/i_lied_for_12_years_about_my_identity_but_theres/m8003o8/,Neutral
20124,m7whbem,comment,,"Baby, you are too young to have your life torn apart by a crackhead or addiction.  There are other fish in the sea, and at 20 years old, there are the most fish in the sea that there ever will be.

You have so much life to live that there is nothing you’ve done in your life so far that will hinder your future to the point of no return.  However, addiction can and does destroy people.   I know people who are doing life in prison because they had an addiction in their 20s.  I know people with cocaine addictions who went crazy and murdered people with hammers.

Getting clean would be one of the best decisions you’ll ever make in your life. The sooner, the easier. The longer you go, the more it will have a clutch on you."," Baby, you are too young to have your life torn apart by a crackhead or addiction.  There are other fish in the sea, and at 20 years old, there are the most fish in the sea that there ever will be.

You have so much life to live that there is nothing you’ve done in your life so far that will hinder your future to the point of no return.  However, addiction can and does destroy people.   I know people who are doing life in prison because they had an addiction in their 20s.  I know people with cocaine addictions who went crazy and murdered people with hammers.

Getting clean would be one of the best decisions you’ll ever make in your life. The sooner, the easier. The longer you go, the more it will have a clutch on you.",24,,2025-01-19 01:19:43,t3_1i4miv7,,https://www.reddit.com/r/confession/comments/1i4miv7/im_still_seeing_my_insane_crack_smoking_ex/m7whbem/,Neutral
20125,m7wh9mz,comment,,Pretty sure you can find people to do drugs with that don’t suck this much ass.  You do cocaine… now try and have some class about it ffs., Pretty sure you can find people to do drugs with that don’t suck this much ass.  You do cocaine… now try and have some class about it ffs.,14,,2025-01-19 01:19:25,t3_1i4miv7,,https://www.reddit.com/r/confession/comments/1i4miv7/im_still_seeing_my_insane_crack_smoking_ex/m7wh9mz/,Neutral
20126,m7wvrqr,comment,,"Have some self worth girl! Get clean. Stay away from this crackheaded loser. 

You’re at a fork in the road. One path leads you down a very dark and miserable road and the other path gives you a chance at a healthy-normal life. 

You can either make excuses for the situation or you can put in the work to better yourself. No one can do it for you. Get a gah damn vibrator and go to rehab. Your life will be immensely better for it. Trust me."," Have some self worth girl! Get clean. Stay away from this crackheaded loser. 

You’re at a fork in the road. One path leads you down a very dark and miserable road and the other path gives you a chance at a healthy-normal life. 

You can either make excuses for the situation or you can put in the work to better yourself. No one can do it for you. Get a gah damn vibrator and go to rehab. Your life will be immensely better for it. Trust me.",2,,2025-01-19 02:39:34,t3_1i4miv7,,https://www.reddit.com/r/confession/comments/1i4miv7/im_still_seeing_my_insane_crack_smoking_ex/m7wvrqr/,Neutral
