Unnamed: 0,id,type,title,content,text,score,num_comments,created_utc,parent_id,sentiment,url,label
19197,m8ec1z9,comment,,"You posted this exact thing recently..different sub maybe, can’t remember. Anyway, I’ll repeat what I said. He’s not ready for the commitment of marriage. He’s not even emotionally ready for your current relationship.  He wants his cake and he wants to also eat it all while still having it for later. He will look to you for blame, for every little thwarted perk and every single opportunity he thinks he lost due to you and your kids.  

He is an emotional train wreck.  Is that really what you and the kids need?   A broken man who just can’t figure out his life path?  You’re smartest move  would be to ask him to take that job and break up."," You posted this exact thing recently..different sub maybe, can’t remember. Anyway, I’ll repeat what I said. He’s not ready for the commitment of marriage. He’s not even emotionally ready for your current relationship.  He wants his cake and he wants to also eat it all while still having it for later. He will look to you for blame, for every little thwarted perk and every single opportunity he thinks he lost due to you and your kids.  

He is an emotional train wreck.  Is that really what you and the kids need?   A broken man who just can’t figure out his life path?  You’re smartest move  would be to ask him to take that job and break up.",1,,2025-01-21 19:07,t3_1i6nvxw,,https://www.reddit.com/r/offmychest/comments/1i6nvxw/cant_handle_constant_negativity_anymore/m8ec1z9/,Neutral
19198,1i6qkc7,post,My partner called me skinny,"The last couple weeks have been productive, I’m getting a lot done but the trade is I’m definitely eating less. I just forget and my body doesn’t give me the cues I’m expecting. I drink plenty and eat when I feel hungry and have time and I take as good a care of my body as I can in this economy. 

My partner(35M) is thin and I have noticed he has some issues with that. We both compliment each other often, we are very quick to affirm and support each other. The other day he called me beautiful and said I’ve been looking skinny the last couple days and it hit me so hard. I immediately felt detached or numb or something. I replayed it in my head and he said it in a positive way and my brain did the math skinny = better. I felt a little panicky at first, went to wash my face and cried a little. I know most people have a good view toward being called skinny and it wouldn’t have a negative effect. It’s kinda messing with my head a little though, I feel like I’m stepping back in time and I care about that again. I haven’t struggled with disordered eating or weight obsession in years. I know I’ll be fine, but I didn’t have anyone else to talk it through with and it feels a little less overwhelming when I tell someone. ","My partner called me skinny The last couple weeks have been productive, I’m getting a lot done but the trade is I’m definitely eating less. I just forget and my body doesn’t give me the cues I’m expecting. I drink plenty and eat when I feel hungry and have time and I take as good a care of my body as I can in this economy. 

My partner(35M) is thin and I have noticed he has some issues with that. We both compliment each other often, we are very quick to affirm and support each other. The other day he called me beautiful and said I’ve been looking skinny the last couple days and it hit me so hard. I immediately felt detached or numb or something. I replayed it in my head and he said it in a positive way and my brain did the math skinny = better. I felt a little panicky at first, went to wash my face and cried a little. I know most people have a good view toward being called skinny and it wouldn’t have a negative effect. It’s kinda messing with my head a little though, I feel like I’m stepping back in time and I care about that again. I haven’t struggled with disordered eating or weight obsession in years. I know I’ll be fine, but I didn’t have anyone else to talk it through with and it feels a little less overwhelming when I tell someone. ",7,1,2025-01-21 19:13,,,https://www.reddit.com/r/offmychest/comments/1i6qkc7/my_partner_called_me_skinny/,Neutral
19199,1i6qkyg,post,I don't know how i feel about my ex,"I dont know what to do or who to talk to so im venting here.

I saw my ex at my sisters family event and it destroys me emotionally every time.

We stayed on good terms. We kinda talked after our breakup every so often, usually just to say happy birthday and catch up a bit that day, but nothing substantial, and we were almost no contact for the past 2-3 years. Except for my sisters family event.  
I knew she would be there as its a yearly event and i've met her through my sister. And each year i go its the same story. I get this weird feeling/pain in my chest and stomach, i can't eat, my hands and feet feel weak. I cant think straight and its like some kind of dark falls over my eyes. It takes me great effort to keep my composure and i dont know how to act, what to do or what to say. I cant put it into words properly.

And the reason im so mad is because i dont know why. I dont think about her, like at all. I live my life, go to work, enjoy time with family and friends. I dont follow her on social media, i dont inquire about her. Everything i know about her i've heard in passing. When im alone and feel lonely she doesn't come to my mind. She's gone from my life and from my mind. And i've done my best to stay out of hers. Since she got with her now fiance we didn't text, call or see each other. She's seemed to move on, so I've done my best to live my life, find my own happiness and not ruin hers.

And thats why it maddens me so much that i feel this way when i see her. Like what is it that makes me have a such a reaction?  
It cant be love, since i dont even know her anymore. So much time has passed, i have grown and changed a lot in that time, i assume the same for her. The versions of us that were in love are long gone, and all we remain are strangers who used to know each other. Not to mention she's engaged. And if its not love, then it makes even less sense. Like what the fuck is bringing me to tears when i go to sleep after seeing her? I feel like in an never ending cycle of getting over her, feeling better, feeling good, just for her to appear for it to come crumbling down. I fucking hate it. I just want it to stop.  
And there is this distance and awkwardness i feel between us. We didn't fight, and if she moved on completely why does it feel like she doesn't want to see me? Its not like i want or choose to see her, but its something that bugs me. Like if she moved on completely that wouldn't she treat me like any regular guy? An acquaintance from long ago. But i dont feel that from her. I feel like there is some wall, something that needs to be said before we can interact normally.  
And the worst part is that it could be all in my head. I dont know how she feels. I feel like it would be easier if she outright told me how she felt truly, even better if she's moved on, at least i could make some sense of the situation and have some ground to stand on. But im stuck not knowing anything, not knowing how i feel, how she feels, what im supposed to do, what to think and how to navigate this mess in my head. I feel desperate. It just seems that no mater what i do, no matter how much progress i think i made it takes so little to return me to square one. Its exhausting. I don't know if its a good idea to ask her for a conversation, i dont know if it would bring any good to either of us. And also what does this all speak of me? What kind of a man and a person does it make me if i can't even figure this shit out after 6 years. Even if i found someone else, how would all of this be fair to them? What else could i have done? How do you let go and what does that even mean. The more i think about these things the more vague they become.

I have ovethought every scenario, every emotion any reason for this, and the only thing i figured out: Im tired.","I don't know how i feel about my ex I dont know what to do or who to talk to so im venting here.

I saw my ex at my sisters family event and it destroys me emotionally every time.

We stayed on good terms. We kinda talked after our breakup every so often, usually just to say happy birthday and catch up a bit that day, but nothing substantial, and we were almost no contact for the past 2-3 years. Except for my sisters family event.  
I knew she would be there as its a yearly event and i've met her through my sister. And each year i go its the same story. I get this weird feeling/pain in my chest and stomach, i can't eat, my hands and feet feel weak. I cant think straight and its like some kind of dark falls over my eyes. It takes me great effort to keep my composure and i dont know how to act, what to do or what to say. I cant put it into words properly.

And the reason im so mad is because i dont know why. I dont think about her, like at all. I live my life, go to work, enjoy time with family and friends. I dont follow her on social media, i dont inquire about her. Everything i know about her i've heard in passing. When im alone and feel lonely she doesn't come to my mind. She's gone from my life and from my mind. And i've done my best to stay out of hers. Since she got with her now fiance we didn't text, call or see each other. She's seemed to move on, so I've done my best to live my life, find my own happiness and not ruin hers.

And thats why it maddens me so much that i feel this way when i see her. Like what is it that makes me have a such a reaction?  
It cant be love, since i dont even know her anymore. So much time has passed, i have grown and changed a lot in that time, i assume the same for her. The versions of us that were in love are long gone, and all we remain are strangers who used to know each other. Not to mention she's engaged. And if its not love, then it makes even less sense. Like what the fuck is bringing me to tears when i go to sleep after seeing her? I feel like in an never ending cycle of getting over her, feeling better, feeling good, just for her to appear for it to come crumbling down. I fucking hate it. I just want it to stop.  
And there is this distance and awkwardness i feel between us. We didn't fight, and if she moved on completely why does it feel like she doesn't want to see me? Its not like i want or choose to see her, but its something that bugs me. Like if she moved on completely that wouldn't she treat me like any regular guy? An acquaintance from long ago. But i dont feel that from her. I feel like there is some wall, something that needs to be said before we can interact normally.  
And the worst part is that it could be all in my head. I dont know how she feels. I feel like it would be easier if she outright told me how she felt truly, even better if she's moved on, at least i could make some sense of the situation and have some ground to stand on. But im stuck not knowing anything, not knowing how i feel, how she feels, what im supposed to do, what to think and how to navigate this mess in my head. I feel desperate. It just seems that no mater what i do, no matter how much progress i think i made it takes so little to return me to square one. Its exhausting. I don't know if its a good idea to ask her for a conversation, i dont know if it would bring any good to either of us. And also what does this all speak of me? What kind of a man and a person does it make me if i can't even figure this shit out after 6 years. Even if i found someone else, how would all of this be fair to them? What else could i have done? How do you let go and what does that even mean. The more i think about these things the more vague they become.

I have ovethought every scenario, every emotion any reason for this, and the only thing i figured out: Im tired.",1,0,2025-01-21 19:14,,,https://www.reddit.com/r/offmychest/comments/1i6qkyg/i_dont_know_how_i_feel_about_my_ex/,Neutral
19200,m8eduky,comment,,"Thank you for the tip. Now I don't mean to sound rude, but I don't see how that would help. Creating a way for myself to make money would take more time and effort that I don't have. I'm extremely depressed and getting up is already a chore and you suggest I make a whole business from scratch. I'm hoping that someone can give me advice on a time that they went through that might have been similar. Like what did they tell themselves to get through the day without hating their life. How long did it take for them to find a job? What finally changed?

Like, I'm a good writer. I was recommended to be an English tutor at my college. It's what I look for in a job. The only way I could see myself ""making"" my own money as opposed to earning it would be to become a writer. The two ways to do that are to self-publish, which requires a length of time that I simply do not want to expend. I need to move out. I can't wait years for my Novelist career to take off. The other is to work for a newspaper or some sort of magazine. I do not have a portfolio. I do not have years of experience. They will require these things.

If I could ""make"" money, I think I would've by now."," Thank you for the tip. Now I don't mean to sound rude, but I don't see how that would help. Creating a way for myself to make money would take more time and effort that I don't have. I'm extremely depressed and getting up is already a chore and you suggest I make a whole business from scratch. I'm hoping that someone can give me advice on a time that they went through that might have been similar. Like what did they tell themselves to get through the day without hating their life. How long did it take for them to find a job? What finally changed?

Like, I'm a good writer. I was recommended to be an English tutor at my college. It's what I look for in a job. The only way I could see myself ""making"" my own money as opposed to earning it would be to become a writer. The two ways to do that are to self-publish, which requires a length of time that I simply do not want to expend. I need to move out. I can't wait years for my Novelist career to take off. The other is to work for a newspaper or some sort of magazine. I do not have a portfolio. I do not have years of experience. They will require these things.

If I could ""make"" money, I think I would've by now.",1,,2025-01-21 19:15,t1_m8ebwkd,,https://www.reddit.com/r/offmychest/comments/1i6qa3w/feel_like_ive_ruined_my_life_and_im_only_25/m8eduky/,Neutral
19201,m8edzxq,comment,,"For me it sounds like, in that moment, you wanted to help the other guy. It may affect your chances, it may not. But you helped him. In my book, you are the bigger man that has his priorities straight (at least on that front) and that is nothing to feel upset about."," For me it sounds like, in that moment, you wanted to help the other guy. It may affect your chances, it may not. But you helped him. In my book, you are the bigger man that has his priorities straight (at least on that front) and that is nothing to feel upset about.",2,,2025-01-21 19:16,t1_m8ecdze,,https://www.reddit.com/r/offmychest/comments/1i6psof/i_disappointed_everyone/m8edzxq/,Neutral
19202,1i6qryo,post,Afraid my bf (33m)will choose his mom over me (30f) in the future,"My boyfriend is 33m and asian and I am 30f and white. He comes from traditional chinese culture where family is an important value and he wants his mom to live w us when we get married as he is living with her now. We have been together for 4 years and I am supposed to move in with them next year. They have a bit of an enmeshed relationship and she has high expectations of him and expects her to do what she asks of him. I worry he will put her before our family of creation. He doesnt see it as a prioritization thing when I talk to him about it or choosing one or another he just says family is imp to him. I am scared that I will feel trapped in the future due to not having own space and his mom getting older and needing more care. I am also really scared to end this relationship. If we were able to live seperately or buy a house w a in-law suite, I wouldnt think twice about being with him. I am so sad and know if i breakup w him it needs to be sooner rather than later as I am 30 and have a fear of wasting my time :(","Afraid my bf (33m)will choose his mom over me (30f) in the future My boyfriend is 33m and asian and I am 30f and white. He comes from traditional chinese culture where family is an important value and he wants his mom to live w us when we get married as he is living with her now. We have been together for 4 years and I am supposed to move in with them next year. They have a bit of an enmeshed relationship and she has high expectations of him and expects her to do what she asks of him. I worry he will put her before our family of creation. He doesnt see it as a prioritization thing when I talk to him about it or choosing one or another he just says family is imp to him. I am scared that I will feel trapped in the future due to not having own space and his mom getting older and needing more care. I am also really scared to end this relationship. If we were able to live seperately or buy a house w a in-law suite, I wouldnt think twice about being with him. I am so sad and know if i breakup w him it needs to be sooner rather than later as I am 30 and have a fear of wasting my time :(",0,2,2025-01-21 19:22,,,https://www.reddit.com/r/offmychest/comments/1i6qryo/afraid_my_bf_33mwill_choose_his_mom_over_me_30f/,Neutral
19203,m8effep,comment,,"I know it doesn't matter and it doesn't change what I have done but after my roommate mentioned it i can't even sleep. It's so frustrating because if he gets selected I will feel guilty the entire year. I don't know man, I don't know.


Everyone is right not sharing anyone, anything but asking everyone, everything. It's frustrating, it feels toxic, I don't like this kind of politics in between batchmates. I don't like this game. This cut throat game is too hard man , I didn't think of these things."," I know it doesn't matter and it doesn't change what I have done but after my roommate mentioned it i can't even sleep. It's so frustrating because if he gets selected I will feel guilty the entire year. I don't know man, I don't know.


Everyone is right not sharing anyone, anything but asking everyone, everything. It's frustrating, it feels toxic, I don't like this kind of politics in between batchmates. I don't like this game. This cut throat game is too hard man , I didn't think of these things.",1,,2025-01-21 19:23,t1_m8edzxq,,https://www.reddit.com/r/offmychest/comments/1i6psof/i_disappointed_everyone/m8effep/,Neutral
19204,1i6qtes,post,living with my brother with autism has made me lose all hope,"for context I live with my mom, roommate, my brother, and my sister

my brother has autism and this week he ran away from home and this is not the first time he ran away b/c i did not let him watch my pc. now he got my mother sent to court im hoping that she does not go to jail while at court he was kicked out b/c he started saying he was so happy that shes going to jail (she not going to jail) and when he found out he screamed and so they put him in cuff and put into a mental place after that he came back home wanting to go back b/c they gave him every thing he wanted. and ran off again and blamed it on me so im wondering what i should do ","living with my brother with autism has made me lose all hope for context I live with my mom, roommate, my brother, and my sister

my brother has autism and this week he ran away from home and this is not the first time he ran away b/c i did not let him watch my pc. now he got my mother sent to court im hoping that she does not go to jail while at court he was kicked out b/c he started saying he was so happy that shes going to jail (she not going to jail) and when he found out he screamed and so they put him in cuff and put into a mental place after that he came back home wanting to go back b/c they gave him every thing he wanted. and ran off again and blamed it on me so im wondering what i should do ",1,0,2025-01-21 19:24,,,https://www.reddit.com/r/offmychest/comments/1i6qtes/living_with_my_brother_with_autism_has_made_me/,Neutral
19205,1i6quxg,post,Wanting a bwc so bad,I have always wanted to try a bwc but can't say it coz am shy but that's it now idc what will others think any volunteers?,Wanting a bwc so bad I have always wanted to try a bwc but can't say it coz am shy but that's it now idc what will others think any volunteers?,1,1,2025-01-21 19:26,,,https://www.reddit.com/r/offmychest/comments/1i6quxg/wanting_a_bwc_so_bad/,Neutral
19206,m8ega4o,comment,,"It sounds like you're just looking for someone to tell you to break up with him. Things will not get better moving in together, he will always prioritize mommy."," It sounds like you're just looking for someone to tell you to break up with him. Things will not get better moving in together, he will always prioritize mommy.",1,,2025-01-21 19:26,t3_1i6qryo,,https://www.reddit.com/r/offmychest/comments/1i6qryo/afraid_my_bf_33mwill_choose_his_mom_over_me_30f/m8ega4o/,Neutral
19207,m8eh68p,comment,,"Really sorry that you're going through this. It sounds like a really horrible to place to be, to feel stuck despite your real desire. I hope you know that you're not lazy and you're not useless. You're just in a bad situation, a temporary state where you don't know how to move forward, and that will change.

It sounds like you've got a pretty good grip on why you feel the way you do, and what your negative patterns are. So that's really good. A great first-step, actually. So you're farther along than you think you are. 

When I've struggled with motivation, one thing I've found kinda works is breaking down my goals to smaller and smaller pieces, and by accomplishing them, build a sense of momentum that helps me move forward. Like if I can't get myself to go for a run today, I'll for a walk. If I can't get myself to go for a walk, I'll go outside. If I can't seem to get outside, I'll at least get my shoes on and check the weather. The more you move that doing-stuff muscle, the easier it gets I think."," Really sorry that you're going through this. It sounds like a really horrible to place to be, to feel stuck despite your real desire. I hope you know that you're not lazy and you're not useless. You're just in a bad situation, a temporary state where you don't know how to move forward, and that will change.

It sounds like you've got a pretty good grip on why you feel the way you do, and what your negative patterns are. So that's really good. A great first-step, actually. So you're farther along than you think you are. 

When I've struggled with motivation, one thing I've found kinda works is breaking down my goals to smaller and smaller pieces, and by accomplishing them, build a sense of momentum that helps me move forward. Like if I can't get myself to go for a run today, I'll for a walk. If I can't get myself to go for a walk, I'll go outside. If I can't seem to get outside, I'll at least get my shoes on and check the weather. The more you move that doing-stuff muscle, the easier it gets I think.",1,,2025-01-21 19:30,t3_1i6odzm,,https://www.reddit.com/r/offmychest/comments/1i6odzm/i_want_to_change_but_i_feel_trapped_in_old/m8eh68p/,Neutral
19208,1i6r19x,post,So low it’s the worst ever ,I had a realisation that I’m literally too much for anyone and what breaks my heart is the fake promises of the cliche shit and I’m 31 now and I’m just yeah done. Times up ,So low it’s the worst ever  I had a realisation that I’m literally too much for anyone and what breaks my heart is the fake promises of the cliche shit and I’m 31 now and I’m just yeah done. Times up ,2,2,2025-01-21 19:33,,,https://www.reddit.com/r/offmychest/comments/1i6r19x/so_low_its_the_worst_ever/,Neutral
19209,m8eih05,comment,,"i hear you OP. it’s hard being reminded of all the good struggles you’ve had to overcome to be in a good place with food and your body. only to be smacked in the face with the fact that those around you still think under that umbrella of “skinny = better”.

the good thing is you know the truth. ^ that statement isn’t true & you are worth more than your appearance. 

you could speak to him. mention to him how that mentality is soooooo 2000’s if you think it’d be a productive talk. if not, just remind yourself you hold your value as a personal elsewhere. not in the way you look or the number on the scale. (you know this already, don’t forget it)"," i hear you OP. it’s hard being reminded of all the good struggles you’ve had to overcome to be in a good place with food and your body. only to be smacked in the face with the fact that those around you still think under that umbrella of “skinny = better”.

the good thing is you know the truth. ^ that statement isn’t true & you are worth more than your appearance. 

you could speak to him. mention to him how that mentality is soooooo 2000’s if you think it’d be a productive talk. if not, just remind yourself you hold your value as a personal elsewhere. not in the way you look or the number on the scale. (you know this already, don’t forget it)",3,,2025-01-21 19:36,t3_1i6qkc7,,https://www.reddit.com/r/offmychest/comments/1i6qkc7/my_partner_called_me_skinny/m8eih05/,Neutral
