Unnamed: 0,id,type,title,content,text,score,num_comments,created_utc,parent_id,sentiment,url,label
19862,cadzqh8,comment,,I'm pretty sure sex offenders have some of the lowest recidivism rates. , I'm pretty sure sex offenders have some of the lowest recidivism rates. ,4,,2013-06-07 10:56:55,t3_1fu5p5,,https://www.reddit.com/r/confession/comments/1fu5p5/i_got_a_reformed_sex_offender_kicked_out_of_my/cadzqh8/,Neutral
19863,cae3p1i,comment,,"I agree with the concept of sex offender registries, and think there should be similar registries for crimes of a similarly dangerous nature. Sexual assault and rape are incredibly serious crimes and while I don't entirely believe in the ""lock 'em up forever and never let them have a life ever again"" mentality, I think it is very important for authorities etc to keep tabs on someone who has committed a sexual offence. It's a preventative measure to make sure they don't reoffend."," I agree with the concept of sex offender registries, and think there should be similar registries for crimes of a similarly dangerous nature. Sexual assault and rape are incredibly serious crimes and while I don't entirely believe in the ""lock 'em up forever and never let them have a life ever again"" mentality, I think it is very important for authorities etc to keep tabs on someone who has committed a sexual offence. It's a preventative measure to make sure they don't reoffend.",-1,,2013-06-07 15:26:33,t1_cae3fy5,,https://www.reddit.com/r/confession/comments/1fu5p5/i_got_a_reformed_sex_offender_kicked_out_of_my/cae3p1i/,Neutral
19864,cadwpzd,comment,,"It depends on the source and the sort of measurements the studies in question use, but as far as I know (and I could be wrong, totally) sex offenders released from prison are about four times more likely to re-offend than non-sex offending criminals. At the state level anyway. 

I did a lot of searching on google scholar to try and assuage my guilt, but the statistics are a cold comfort :(

This source is a little old, but illustrates the recidivism rates as of 1994: http://www.bjs.gov/content/pub/pdf/rsorp94.pdf"," It depends on the source and the sort of measurements the studies in question use, but as far as I know (and I could be wrong, totally) sex offenders released from prison are about four times more likely to re-offend than non-sex offending criminals. At the state level anyway. 

I did a lot of searching on google scholar to try and assuage my guilt, but the statistics are a cold comfort :(

This source is a little old, but illustrates the recidivism rates as of 1994: http://www.bjs.gov/content/pub/pdf/rsorp94.pdf",2,,2013-06-07 05:46:18,t1_cadweor,,https://www.reddit.com/r/confession/comments/1fu5p5/i_got_a_reformed_sex_offender_kicked_out_of_my/cadwpzd/,Neutral
19865,cae1y26,comment,,"Yes, ruining a man's life was an 'immature move'. One of the few sex offenders who was seemingly overcoming his issues, but kicking him back down was an 'immature move'."," Yes, ruining a man's life was an 'immature move'. One of the few sex offenders who was seemingly overcoming his issues, but kicking him back down was an 'immature move'.",1,,2013-06-07 13:59:16,t1_cae0wf2,,https://www.reddit.com/r/confession/comments/1fu5p5/i_got_a_reformed_sex_offender_kicked_out_of_my/cae1y26/,Neutral
19866,cadzzik,comment,,"I'm not condoning OP's actions, but if I found out there was a registered sex offender in my class (who supposedly was delinquent at the time), that is my business. That's why the sex offender registry is available online. It's your business to know when a sex offender is living near you, your kids, your school, etc. "," I'm not condoning OP's actions, but if I found out there was a registered sex offender in my class (who supposedly was delinquent at the time), that is my business. That's why the sex offender registry is available online. It's your business to know when a sex offender is living near you, your kids, your school, etc. ",3,,2013-06-07 11:26:44,t1_cadypmb,,https://www.reddit.com/r/confession/comments/1fu5p5/i_got_a_reformed_sex_offender_kicked_out_of_my/cadzzik/,Neutral
19867,cae8a68,comment,,"This sounds great in theory but in practice it treats everyone exactly the same no matter how severe their crime or how likely to reoffend. For example, here's a quote from the NY Times.

“The sheer numbers of sex offenders on the registries in all 50 states — an estimated 674,000 across the country — are overwhelming to local police departments and, at times, to the public, who may not easily distinguish between those who must register because they have repeatedly raped children and those convicted of nonviolent or less serious crimes, like exposing themselves in public.”

And then goes on to say

“at least five states required men to register if they were caught visiting prostitutes. At least 13 required it for urinating in public (in two of which, only if a child was present). No fewer than 29 states required registration for teenagers who had consensual sex with another teenager. And 32 states registered flashers and streakers.”

Clearly, not all of these people require being tracked for life and having all their neighbors be notified when they move to the neighborhood.

The real problem is that if we can't release someone from prison with a reasonable certainty that they won't do it again, we shouldn't let them out. Then again, our prisons aren't built for rehabilitation, the are built for punishment. And punishment doesn't tend to do anything but teach people to hide their behavior better next time."," This sounds great in theory but in practice it treats everyone exactly the same no matter how severe their crime or how likely to reoffend. For example, here's a quote from the NY Times.

“The sheer numbers of sex offenders on the registries in all 50 states — an estimated 674,000 across the country — are overwhelming to local police departments and, at times, to the public, who may not easily distinguish between those who must register because they have repeatedly raped children and those convicted of nonviolent or less serious crimes, like exposing themselves in public.”

And then goes on to say

“at least five states required men to register if they were caught visiting prostitutes. At least 13 required it for urinating in public (in two of which, only if a child was present). No fewer than 29 states required registration for teenagers who had consensual sex with another teenager. And 32 states registered flashers and streakers.”

Clearly, not all of these people require being tracked for life and having all their neighbors be notified when they move to the neighborhood.

The real problem is that if we can't release someone from prison with a reasonable certainty that they won't do it again, we shouldn't let them out. Then again, our prisons aren't built for rehabilitation, the are built for punishment. And punishment doesn't tend to do anything but teach people to hide their behavior better next time.",3,,2013-06-07 18:40:19,t1_cae3p1i,,https://www.reddit.com/r/confession/comments/1fu5p5/i_got_a_reformed_sex_offender_kicked_out_of_my/cae8a68/,Neutral
19868,cajnq47,comment,,"yes, authorities. not the public. there has never been any evidence that sex offender registry works or increases safety, and there has been evidence that it makes reintegration more difficult (obviously), and that it increases the chances of recidivism"," yes, authorities. not the public. there has never been any evidence that sex offender registry works or increases safety, and there has been evidence that it makes reintegration more difficult (obviously), and that it increases the chances of recidivism",1,,2013-06-15 23:40:06,t1_cae3p1i,,https://www.reddit.com/r/confession/comments/1fu5p5/i_got_a_reformed_sex_offender_kicked_out_of_my/cajnq47/,Neutral
19869,cae8p3r,comment,,"Guy was annoying and he looked him up on google/Facebook to troll him. He found out the guy was a convicted child abuser and sex offender who was listed as delinquent. Then he did what he thought was right by alerting his class and authorities. I would have skipped the mass email to the class, but would have notified authorities as OP did. Just because he started off being a douche doesn't mean he didn't eventually do the right thing."," Guy was annoying and he looked him up on google/Facebook to troll him. He found out the guy was a convicted child abuser and sex offender who was listed as delinquent. Then he did what he thought was right by alerting his class and authorities. I would have skipped the mass email to the class, but would have notified authorities as OP did. Just because he started off being a douche doesn't mean he didn't eventually do the right thing.",1,,2013-06-07 18:57:07,t1_cadzfnz,,https://www.reddit.com/r/confession/comments/1fu5p5/i_got_a_reformed_sex_offender_kicked_out_of_my/cae8p3r/,Neutral
19870,cae7y2e,comment,,"Your actions were stupid, reckless, and frankly, I would not want you in any position of authority until you've matured quite a bit. ""Doing what you thought was right"" is the worst fucking excuse in the book. At the risk of over-dramatizing, Hitler ""did what he thought was right"". Obviously you're not even remotely comparable to Hitler, OP, I just hope the comparison will knock some sense into you. Take responsibility for your own actions, don't blame others for your shortcomings.

If you are going into criminal forensics, you will have a great affect on people's LIVES. These are PEOPLE, not fucking anonymous bits online. This isn't the internet any more, and you can't act like you're 13, which is exactly what you just did. From what you wrote, you didn't do what you did for the kiddies (it's not like you were molested yourself, and seeing this man triggered an uncontrollable response in you to hurt him), you did it for your ego. This is so fucking unacceptable.

Imagine if lawyers, judges, or reporters acted like you. Look at how (rightly) upset reddit gets when they do. It doesn't matter that he was a sex offender, not an innocent, it doesn't matter that there was some preliminary evidence against him. You ignored any ethical and moral obligation you had, you ignored the rules and standards of your chosen profession which are there precisely for situations like this, you didn't put the work or effort, and you didn't think about the consequences in the slightest. Frankly, I don't know you or know much about you, but even with your username, you come across as a slightly sheltered, immature person, who may be more used to interacting online than in real life. Who know's maybe you're nothing like that.

Now, I've been quite harsh with you, because I feel you need to be shocked into reality a bit. You really need to understand the gravity of this situation and accept responsibility for your own actions. However, you do seem very aware that what you did is wrong, and quite genuine in your desire not to let it repeat. I don't think you are a bad person, you simply seem immature, and that's ok. You can learn, you'll become more mature. So learn from this experience. Every time you are confronted with a similar situation, remember that its easy to make a snap judgement. Your job is to do due diligence, make sure you know ALL the facts, and if you must judge, to do so impartially, not so you can stroke your dick. Lawyers generally get some training and classes along these lines, precisely because they will have positions with such power. It's unfortunate that you didn't, but on the other hand, this one experience I think will be worth more than 100 such classes.

We've all made mistakes, I certainly have. Perhaps I've simply been luckier than you in that mine haven't affected anyone's life yet. You're immature. That can change. I think there's a really good chance this is the kick in the gut you need, and if you truly accept this as a learning experience, you can use this to become a much better person and forensic science major. Everyone else seems to be commentating that yes, you didn't do a great job, but you can move past it. Do not listen to this idiot who tells you to not blame yourself. I fucking disagree. Don't 'move past' this, I hope that 20 years down the line you still remember this incident, and that it still brings about a slight tinge of shame to your cheeks. That's good. That means you've learned from it, that you won't do something like this again, no matter what personal, political, or work pressures are on you. Good luck OP, and I really do hope you become an excellent forensic scientist. Which means not just the skills, but also the proper respect for ethics and morality."," Your actions were stupid, reckless, and frankly, I would not want you in any position of authority until you've matured quite a bit. ""Doing what you thought was right"" is the worst fucking excuse in the book. At the risk of over-dramatizing, Hitler ""did what he thought was right"". Obviously you're not even remotely comparable to Hitler, OP, I just hope the comparison will knock some sense into you. Take responsibility for your own actions, don't blame others for your shortcomings.

If you are going into criminal forensics, you will have a great affect on people's LIVES. These are PEOPLE, not fucking anonymous bits online. This isn't the internet any more, and you can't act like you're 13, which is exactly what you just did. From what you wrote, you didn't do what you did for the kiddies (it's not like you were molested yourself, and seeing this man triggered an uncontrollable response in you to hurt him), you did it for your ego. This is so fucking unacceptable.

Imagine if lawyers, judges, or reporters acted like you. Look at how (rightly) upset reddit gets when they do. It doesn't matter that he was a sex offender, not an innocent, it doesn't matter that there was some preliminary evidence against him. You ignored any ethical and moral obligation you had, you ignored the rules and standards of your chosen profession which are there precisely for situations like this, you didn't put the work or effort, and you didn't think about the consequences in the slightest. Frankly, I don't know you or know much about you, but even with your username, you come across as a slightly sheltered, immature person, who may be more used to interacting online than in real life. Who know's maybe you're nothing like that.

Now, I've been quite harsh with you, because I feel you need to be shocked into reality a bit. You really need to understand the gravity of this situation and accept responsibility for your own actions. However, you do seem very aware that what you did is wrong, and quite genuine in your desire not to let it repeat. I don't think you are a bad person, you simply seem immature, and that's ok. You can learn, you'll become more mature. So learn from this experience. Every time you are confronted with a similar situation, remember that its easy to make a snap judgement. Your job is to do due diligence, make sure you know ALL the facts, and if you must judge, to do so impartially, not so you can stroke your dick. Lawyers generally get some training and classes along these lines, precisely because they will have positions with such power. It's unfortunate that you didn't, but on the other hand, this one experience I think will be worth more than 100 such classes.

We've all made mistakes, I certainly have. Perhaps I've simply been luckier than you in that mine haven't affected anyone's life yet. You're immature. That can change. I think there's a really good chance this is the kick in the gut you need, and if you truly accept this as a learning experience, you can use this to become a much better person and forensic science major. Everyone else seems to be commentating that yes, you didn't do a great job, but you can move past it. Do not listen to this idiot who tells you to not blame yourself. I fucking disagree. Don't 'move past' this, I hope that 20 years down the line you still remember this incident, and that it still brings about a slight tinge of shame to your cheeks. That's good. That means you've learned from it, that you won't do something like this again, no matter what personal, political, or work pressures are on you. Good luck OP, and I really do hope you become an excellent forensic scientist. Which means not just the skills, but also the proper respect for ethics and morality.",8,,2013-06-07 18:26:49,t1_cadwdqy,,https://www.reddit.com/r/confession/comments/1fu5p5/i_got_a_reformed_sex_offender_kicked_out_of_my/cae7y2e/,Neutral
19871,cae4szj,comment,,"Well from my experience in related fields and my education. I understand that sex offenders have the lowest recidivism rates out of all types of offenders. The programming and supervision techniques tend to work. Now I could be wrong and that could be out dated. 

I'm not sure if you're trolling or not and I don't feel like circle jerking. "," Well from my experience in related fields and my education. I understand that sex offenders have the lowest recidivism rates out of all types of offenders. The programming and supervision techniques tend to work. Now I could be wrong and that could be out dated. 

I'm not sure if you're trolling or not and I don't feel like circle jerking. ",-1,,2013-06-07 16:15:56,t1_cae3080,,https://www.reddit.com/r/confession/comments/1fu5p5/i_got_a_reformed_sex_offender_kicked_out_of_my/cae4szj/,Neutral
19872,caem6nu,comment,,"> my rational side is telling me I shouldn't feel bad

This is the most chilling thing you say in the whole thread. Your emotions are saying ""Vengeance to the sex offender monster! Protect the innocent children!"" You are so blatantly using your emotion in attempt to justify your actions. And you twist it around and call it *rationality.*

I simply have no words to describe that."," > my rational side is telling me I shouldn't feel bad

This is the most chilling thing you say in the whole thread. Your emotions are saying ""Vengeance to the sex offender monster! Protect the innocent children!"" You are so blatantly using your emotion in attempt to justify your actions. And you twist it around and call it *rationality.*

I simply have no words to describe that.",1,,2013-06-08 07:18:56,t1_caduhvd,,https://www.reddit.com/r/confession/comments/1fu5p5/i_got_a_reformed_sex_offender_kicked_out_of_my/caem6nu/,Neutral
19873,cae2nio,comment,,"Perhaps a little over zealous, however, as a women if there's a sex offender roaming around (non-reformed) I wouldn't mind knowing. I think he made the decision with the information he had, and was trying to do the right thing by warning people."," Perhaps a little over zealous, however, as a women if there's a sex offender roaming around (non-reformed) I wouldn't mind knowing. I think he made the decision with the information he had, and was trying to do the right thing by warning people.",1,,2013-06-07 14:36:57,t1_cadzw46,,https://www.reddit.com/r/confession/comments/1fu5p5/i_got_a_reformed_sex_offender_kicked_out_of_my/cae2nio/,Neutral
19874,cadx0q0,comment,,I thought even after he served him time he still had to register as a sex offender for the rest of his life., I thought even after he served him time he still had to register as a sex offender for the rest of his life.,1,,2013-06-07 06:06:26,t1_cadwvva,,https://www.reddit.com/r/confession/comments/1fu5p5/i_got_a_reformed_sex_offender_kicked_out_of_my/cadx0q0/,Neutral
19875,cae9ftm,comment,,"As I said, I agree with the concept, not necessarily how it is currently executed. I'm referring specifically to very serious crimes such as rape, child molestation and sexual assault (as well as crimes that aren't sexual offences such as murder etc); crimes that are violent and have a severe damaging impact on the victim. Putting someone on a permanent sex offender registry for pissing on the street is just silly to me.

I do think that a certain amount of punishment is necessary in any justice system; the problem though is that instead of viewing the justice system as a means of protecting citizens, a lot of people seem to view it as a means of enacting revenge on the criminal, and so the punishment aspect is overemphasised. IMO the most efficient way of protecting citizens from a dangerous criminal is to remove the latter from society for a given length of time (depending on the severity of their crime), attempt to rehabilitate them (as most criminals have reasons for commiting their crimes, and rehabilitation might help them change their circumstances outside of prison so they don't feel compelled towards illegal activity), and keep tabs on them in some way (again, depending on the severity of the crime) to prevent a reoffence. You may say that if the first two steps are successful then there shouldn't be a need for the third, but the reality is that that won't always be the case no matter how long you lock someone up for."," As I said, I agree with the concept, not necessarily how it is currently executed. I'm referring specifically to very serious crimes such as rape, child molestation and sexual assault (as well as crimes that aren't sexual offences such as murder etc); crimes that are violent and have a severe damaging impact on the victim. Putting someone on a permanent sex offender registry for pissing on the street is just silly to me.

I do think that a certain amount of punishment is necessary in any justice system; the problem though is that instead of viewing the justice system as a means of protecting citizens, a lot of people seem to view it as a means of enacting revenge on the criminal, and so the punishment aspect is overemphasised. IMO the most efficient way of protecting citizens from a dangerous criminal is to remove the latter from society for a given length of time (depending on the severity of their crime), attempt to rehabilitate them (as most criminals have reasons for commiting their crimes, and rehabilitation might help them change their circumstances outside of prison so they don't feel compelled towards illegal activity), and keep tabs on them in some way (again, depending on the severity of the crime) to prevent a reoffence. You may say that if the first two steps are successful then there shouldn't be a need for the third, but the reality is that that won't always be the case no matter how long you lock someone up for.",1,,2013-06-07 19:28:22,t1_cae8a68,,https://www.reddit.com/r/confession/comments/1fu5p5/i_got_a_reformed_sex_offender_kicked_out_of_my/cae9ftm/,Neutral
