Unnamed: 0,id,type,title,content,text,score,num_comments,created_utc,parent_id,sentiment,url,label
20253,m7wexhm,comment,,"Do you have any family at all that you can stay with for a month or two to get back on your feet? Even if you have to beg? It would be worth it. 

Go find a soup kitchen if there’s one near by you’ll feel so much better after you eat. 

I love you friend please don’t take your life hang on.

There’s a version of you 30 years in the future that looking back thinking how glad they are they hung on.

Don’t let go!"," Do you have any family at all that you can stay with for a month or two to get back on your feet? Even if you have to beg? It would be worth it. 

Go find a soup kitchen if there’s one near by you’ll feel so much better after you eat. 

I love you friend please don’t take your life hang on.

There’s a version of you 30 years in the future that looking back thinking how glad they are they hung on.

Don’t let go!",1,,2025-01-19 01:06:13,t3_1i4bn48,,https://www.reddit.com/r/confession/comments/1i4bn48/ive_been_genuinely_considering_ending_everything/m7wexhm/,Neutral
20254,m7wqznq,comment,,"ending everything won't fix shit. your mechanic will never get paid, your mom will be struggling for years sad about you, you'll never eat again.

you're picking the opposite of a solution.

tell your mom you're struggling.
go register at every food bank in your area
talk to your mechanic and tell them you're having serious problems right now.

jesus christ. if you're willing to end everything at least try using actual words first.  like you're so desperate to never feel vulnerable you'll just die.

thats silly.

people want to help you
people want you to succeed"," ending everything won't fix shit. your mechanic will never get paid, your mom will be struggling for years sad about you, you'll never eat again.

you're picking the opposite of a solution.

tell your mom you're struggling.
go register at every food bank in your area
talk to your mechanic and tell them you're having serious problems right now.

jesus christ. if you're willing to end everything at least try using actual words first.  like you're so desperate to never feel vulnerable you'll just die.

thats silly.

people want to help you
people want you to succeed",1,,2025-01-19 02:13:51,t3_1i4bn48,,https://www.reddit.com/r/confession/comments/1i4bn48/ive_been_genuinely_considering_ending_everything/m7wqznq/,Neutral
20255,m7x1wsj,comment,,"Money is a fleeting thing and ultimately means nothing. Your life however is the most precious thing you have. If you end it you can never climb that hill. Maybe you are at the bottom but in 2 months you could be at the top. Life is funny that way.  I know you want to pay every bill and I am not sure where you are from, but maybe prioritize your bills. If some bills are revolving credit let them slide. Same with school loans. They can’t take the degree away now! After 10 years of no paying they write it off. Maybe ur credit score will go down but your rent and car and food are there just pay cash. Also look at what you do for a living. Is it time to say I need a raise? Everyone wants side jobs but honestly corner your snot nose little boss for a raise and go with ammunition in how your service makes them money and you need more than the yearly 1% cost of living. If you did get anything. Do not end anything over money. Set up a gofundme for yourself. Do not despair. Great things are always around the corner. Please do not give up. Seek someone to talk to. Go to to the employment office. Go to social services. Be proactive. You have people who love you. Remember the only thing we know for sure about death is the people who loved you left behind grieve the loss of your life and presence for the rest of theirs."," Money is a fleeting thing and ultimately means nothing. Your life however is the most precious thing you have. If you end it you can never climb that hill. Maybe you are at the bottom but in 2 months you could be at the top. Life is funny that way.  I know you want to pay every bill and I am not sure where you are from, but maybe prioritize your bills. If some bills are revolving credit let them slide. Same with school loans. They can’t take the degree away now! After 10 years of no paying they write it off. Maybe ur credit score will go down but your rent and car and food are there just pay cash. Also look at what you do for a living. Is it time to say I need a raise? Everyone wants side jobs but honestly corner your snot nose little boss for a raise and go with ammunition in how your service makes them money and you need more than the yearly 1% cost of living. If you did get anything. Do not end anything over money. Set up a gofundme for yourself. Do not despair. Great things are always around the corner. Please do not give up. Seek someone to talk to. Go to to the employment office. Go to social services. Be proactive. You have people who love you. Remember the only thing we know for sure about death is the people who loved you left behind grieve the loss of your life and presence for the rest of theirs.",1,,2025-01-19 03:14:21,t3_1i4bn48,,https://www.reddit.com/r/confession/comments/1i4bn48/ive_been_genuinely_considering_ending_everything/m7x1wsj/,Neutral
20256,m7x2ypf,comment,,Please make sure you stay strong and pray. Have a plan. I am in the same boat literally about to lose everything I have worked the past 6 years and I have finally not been able to find a good job because I quit my good job and it’s all my fault  I have been telling myself  everything will be okay as it will but things have been rough. I actually made 1300$ this week in one week doing side work but I’m still behind on bills and owe my landlord like 1k stay strong if I can make it happen so can you. You got this don’t give up I have thought the same thing but my moms is what stop the thoughts be honest and talk with her everything will be ok, Please make sure you stay strong and pray. Have a plan. I am in the same boat literally about to lose everything I have worked the past 6 years and I have finally not been able to find a good job because I quit my good job and it’s all my fault  I have been telling myself  everything will be okay as it will but things have been rough. I actually made 1300$ this week in one week doing side work but I’m still behind on bills and owe my landlord like 1k stay strong if I can make it happen so can you. You got this don’t give up I have thought the same thing but my moms is what stop the thoughts be honest and talk with her everything will be ok,1,,2025-01-19 03:20:28,t3_1i4bn48,,https://www.reddit.com/r/confession/comments/1i4bn48/ive_been_genuinely_considering_ending_everything/m7x2ypf/,Neutral
20257,m7xb0y3,comment,,"Hey. I am sorry you’re struggling.. if you have close family or friends, talk to them. I know they are happy to help you.. 
i was in that situation not to long ago and I jusy pray that everything gonna be okay."," Hey. I am sorry you’re struggling.. if you have close family or friends, talk to them. I know they are happy to help you.. 
i was in that situation not to long ago and I jusy pray that everything gonna be okay.",1,,2025-01-19 04:04:14,t3_1i4bn48,,https://www.reddit.com/r/confession/comments/1i4bn48/ive_been_genuinely_considering_ending_everything/m7xb0y3/,Neutral
20258,m7xibak,comment,,Check for local sources for food handouts. Look for public services and local churches for help. You can get through this and be stronger for it., Check for local sources for food handouts. Look for public services and local churches for help. You can get through this and be stronger for it.,1,,2025-01-19 04:44:24,t3_1i4bn48,,https://www.reddit.com/r/confession/comments/1i4bn48/ive_been_genuinely_considering_ending_everything/m7xibak/,Neutral
20259,m7xjdlz,comment,,"Sharing your problems will never be a burden but rather a relief for both of you, talk to ur mum you are never a burden to someone who cares for you"," Sharing your problems will never be a burden but rather a relief for both of you, talk to ur mum you are never a burden to someone who cares for you",1,,2025-01-19 04:50:47,t3_1i4bn48,,https://www.reddit.com/r/confession/comments/1i4bn48/ive_been_genuinely_considering_ending_everything/m7xjdlz/,Neutral
20260,m7xo0fr,comment,,So what is best for you ., So what is best for you .,1,,2025-01-19 05:20:33,t3_1i4bn48,,https://www.reddit.com/r/confession/comments/1i4bn48/ive_been_genuinely_considering_ending_everything/m7xo0fr/,Neutral
20261,m7y2jjq,comment,,"Not taking out every high interest loan, and credit card and any borrowing possible and betting it all on a game or a color in roulette or something first is wild."," Not taking out every high interest loan, and credit card and any borrowing possible and betting it all on a game or a color in roulette or something first is wild.",1,,2025-01-19 07:12:28,t3_1i4bn48,,https://www.reddit.com/r/confession/comments/1i4bn48/ive_been_genuinely_considering_ending_everything/m7y2jjq/,Neutral
20262,m7y6a1p,comment,,"Let’s start a meal train. Everyday someone can u er you food or groceries , cool?"," Let’s start a meal train. Everyday someone can u er you food or groceries , cool?",1,,2025-01-19 07:47:46,t3_1i4bn48,,https://www.reddit.com/r/confession/comments/1i4bn48/ive_been_genuinely_considering_ending_everything/m7y6a1p/,Neutral
20263,m7y9mpd,comment,,"If you don't care about yourself, I can assure you that the pain you'll cause to your mom would be devastating. You're not only killing yourself, you're killing her too in the process.

Talk to your mom and tell her how you feel openly.

I've been through shit a good part of my life and there's always sunny days coming after the storm.

Keep pushing. We all are. Some of us are luckier, true, but at a certain point, your luck will turn around too. I guarantee it.

These are not just encouraging words. Are facts and realities proven throughout life. Everyone's life."," If you don't care about yourself, I can assure you that the pain you'll cause to your mom would be devastating. You're not only killing yourself, you're killing her too in the process.

Talk to your mom and tell her how you feel openly.

I've been through shit a good part of my life and there's always sunny days coming after the storm.

Keep pushing. We all are. Some of us are luckier, true, but at a certain point, your luck will turn around too. I guarantee it.

These are not just encouraging words. Are facts and realities proven throughout life. Everyone's life.",1,,2025-01-19 08:20:21,t3_1i4bn48,,https://www.reddit.com/r/confession/comments/1i4bn48/ive_been_genuinely_considering_ending_everything/m7y9mpd/,Neutral
20264,m7ymfbi,comment,,"Everything you say reminds me of my twin brother. He tried to take his life a few years ago. Not a day goes by where I don’t worry about his wellbeing. Nothing in my life will amount to the feeling I had when he picked up the phone after receiving his suicide note. What can someone like me in his life do to prevent this? Money? Support? Nothing seems to work, he seems hopeless always. It consumes me, he’s my other half. Please don’t kill yourself OP. What does that mean for my brother if you do?"," Everything you say reminds me of my twin brother. He tried to take his life a few years ago. Not a day goes by where I don’t worry about his wellbeing. Nothing in my life will amount to the feeling I had when he picked up the phone after receiving his suicide note. What can someone like me in his life do to prevent this? Money? Support? Nothing seems to work, he seems hopeless always. It consumes me, he’s my other half. Please don’t kill yourself OP. What does that mean for my brother if you do?",1,,2025-01-19 10:30:18,t3_1i4bn48,,https://www.reddit.com/r/confession/comments/1i4bn48/ive_been_genuinely_considering_ending_everything/m7ymfbi/,Neutral
20265,m7z0c28,comment,,"You need to listen to this... I wish this soundtrack was around before my brother committed suicide in 2013. Maybe it could have saved him like it has saved me

Suicide Story -WARNING: to sad- by ItsCalledSurviving on #SoundCloud
https://on.soundcloud.com/HYsthkruDLRg78D29"," You need to listen to this... I wish this soundtrack was around before my brother committed suicide in 2013. Maybe it could have saved him like it has saved me

Suicide Story -WARNING: to sad- by ItsCalledSurviving on #SoundCloud
https://on.soundcloud.com/HYsthkruDLRg78D29",1,,2025-01-19 12:40:53,t3_1i4bn48,,https://www.reddit.com/r/confession/comments/1i4bn48/ive_been_genuinely_considering_ending_everything/m7z0c28/,Neutral
20266,m7zjs8d,comment,,"Good morning.  I just wanted to check on you today and ask if you found food?  There was a lot of good advice on here yesterday.   The problem is finding the energy to act on any of it if you are depressed.  It's easy for us to rattle off all of the things that you should do, but when you're struggling, those things are so hard.  I just wanted to encourage you this morning.  Taking a shower always helps me to take that first step.  If you can just set up one good thing today, like finding your nearest food pantry and asking for help, that would be a huge step.  We are still here and thinking about you.  I hope you're doing well."," Good morning.  I just wanted to check on you today and ask if you found food?  There was a lot of good advice on here yesterday.   The problem is finding the energy to act on any of it if you are depressed.  It's easy for us to rattle off all of the things that you should do, but when you're struggling, those things are so hard.  I just wanted to encourage you this morning.  Taking a shower always helps me to take that first step.  If you can just set up one good thing today, like finding your nearest food pantry and asking for help, that would be a huge step.  We are still here and thinking about you.  I hope you're doing well.",1,,2025-01-19 14:48:19,t3_1i4bn48,,https://www.reddit.com/r/confession/comments/1i4bn48/ive_been_genuinely_considering_ending_everything/m7zjs8d/,Neutral
20267,m80ydp6,comment,,"You’re living in the wrong mindset. You can’t see the door of opportunity because of your pessimistic outlook. Start making small consistent
daily changes towards a better, more positive life. Everyone has bills and not ever wants to end their life because of it.  Look all around you, make a plan to change just a few behaviors. Find solutions to fix small problems. Clean your room, wash your windows, work, keep your mind active . Read books on how to overcome obstacles. You can do it. You can make these small positive changes that will turn things around. Stay away from negative people. Good luck!"," You’re living in the wrong mindset. You can’t see the door of opportunity because of your pessimistic outlook. Start making small consistent
daily changes towards a better, more positive life. Everyone has bills and not ever wants to end their life because of it.  Look all around you, make a plan to change just a few behaviors. Find solutions to fix small problems. Clean your room, wash your windows, work, keep your mind active . Read books on how to overcome obstacles. You can do it. You can make these small positive changes that will turn things around. Stay away from negative people. Good luck!",1,,2025-01-19 18:50:47,t3_1i4bn48,,https://www.reddit.com/r/confession/comments/1i4bn48/ive_been_genuinely_considering_ending_everything/m80ydp6/,Neutral
20268,m82imvo,comment,,"There are people who care about you, even if you don't think there are.  

5 years from now, your life will be different. Life always changes.  The person you will be then is waiting on you to make positive choices that will help them.  

Right now, you are the only one who can help your future self.  Stay here. Stay positive. Talk to your mom.  

I lost my mom 14 years ago.  You can't get this time with your mom back.  Make some more memories with her.  Play a card game with her or just visit.  It doesn't have to cost anything. 

Life does give us struggles.  Don't give up. You will be stronger for it."," There are people who care about you, even if you don't think there are.  

5 years from now, your life will be different. Life always changes.  The person you will be then is waiting on you to make positive choices that will help them.  

Right now, you are the only one who can help your future self.  Stay here. Stay positive. Talk to your mom.  

I lost my mom 14 years ago.  You can't get this time with your mom back.  Make some more memories with her.  Play a card game with her or just visit.  It doesn't have to cost anything. 

Life does give us struggles.  Don't give up. You will be stronger for it.",1,,2025-01-19 23:22:53,t3_1i4bn48,,https://www.reddit.com/r/confession/comments/1i4bn48/ive_been_genuinely_considering_ending_everything/m82imvo/,Neutral
20269,m84pa0m,comment,,"Visit food pantries, and go to corporate offices at Salvation Army, Catholic Charities, and Goodwill for vouchers. Go to the government website and see if you qualify for benefits. I found out recently that by taking your life, you increase the risk of suicide in your entire family. I'm so sorry you are hurting, but if you learn how the system works you can find help."," Visit food pantries, and go to corporate offices at Salvation Army, Catholic Charities, and Goodwill for vouchers. Go to the government website and see if you qualify for benefits. I found out recently that by taking your life, you increase the risk of suicide in your entire family. I'm so sorry you are hurting, but if you learn how the system works you can find help.",1,,2025-01-20 08:08:10,t3_1i4bn48,,https://www.reddit.com/r/confession/comments/1i4bn48/ive_been_genuinely_considering_ending_everything/m84pa0m/,Neutral
20270,m7u24tv,comment,,"There has been studies where they interview people who attempted suicide, but ended up living through it. 100% of the people said they regretted doing it as soon as it happened because their life flashed in front of their eyes and they realized how many things they could have done, and didn't. So many things that didn't require money, things they wanted to say to people, places they wanted to see, etc. Even if it's tracking down an old shitty boss and telling him to go to hell, or finding an old crush that you never could talk to before, helping a kid that's being abused, or telling your mother how much you love her and spending the day with her. There are so many possibilities and money has absolutely nothing to do with being happy. There are many miserable millionaires. Doing good deeds for others can become contagious and is very fulfilling. At this point, I would give this a try. What have you got to lose?"," There has been studies where they interview people who attempted suicide, but ended up living through it. 100% of the people said they regretted doing it as soon as it happened because their life flashed in front of their eyes and they realized how many things they could have done, and didn't. So many things that didn't require money, things they wanted to say to people, places they wanted to see, etc. Even if it's tracking down an old shitty boss and telling him to go to hell, or finding an old crush that you never could talk to before, helping a kid that's being abused, or telling your mother how much you love her and spending the day with her. There are so many possibilities and money has absolutely nothing to do with being happy. There are many miserable millionaires. Doing good deeds for others can become contagious and is very fulfilling. At this point, I would give this a try. What have you got to lose?",1,,2025-01-18 17:43:50,t3_1i4bn48,,https://www.reddit.com/r/confession/comments/1i4bn48/ive_been_genuinely_considering_ending_everything/m7u24tv/,Neutral
20271,m7ts7zj,comment,,"Instead of solving, there is THE ENDING EVERYTHING!!

But why?"," Instead of solving, there is THE ENDING EVERYTHING!!

But why?",-1,,2025-01-18 16:54:33,t3_1i4bn48,,https://www.reddit.com/r/confession/comments/1i4bn48/ive_been_genuinely_considering_ending_everything/m7ts7zj/,Neutral
20272,m7tun0l,comment,,"Do you have a 401k you can borrow from? 
There is an app called TooGoodToGo where you can buy food that is almost or at its expiration date from qualifying stores. That could at least get you a snack or meal for cheap depending on what is offered in your area. 
Also check to see if you qualify for food stamps/financial assistance from the government. 
And look for food banks in your area. 
Hope any of these options can help"," Do you have a 401k you can borrow from? 
There is an app called TooGoodToGo where you can buy food that is almost or at its expiration date from qualifying stores. That could at least get you a snack or meal for cheap depending on what is offered in your area. 
Also check to see if you qualify for food stamps/financial assistance from the government. 
And look for food banks in your area. 
Hope any of these options can help",-1,,2025-01-18 17:06:29,t3_1i4bn48,,https://www.reddit.com/r/confession/comments/1i4bn48/ive_been_genuinely_considering_ending_everything/m7tun0l/,Neutral
20273,m7v7471,comment,,Agree with getting food resources. You need to eat., Agree with getting food resources. You need to eat.,5,,2025-01-18 21:14:47,t1_m7twk9e,,https://www.reddit.com/r/confession/comments/1i4bn48/ive_been_genuinely_considering_ending_everything/m7v7471/,Neutral
20274,m7tyjyu,comment,,"I agree with this. As a mother, it wouldn’t matter how much I was struggling myself.. I would want my kid to come to me so we could work things out together."," I agree with this. As a mother, it wouldn’t matter how much I was struggling myself.. I would want my kid to come to me so we could work things out together.",15,,2025-01-18 17:26:04,t1_m7tv1gp,,https://www.reddit.com/r/confession/comments/1i4bn48/ive_been_genuinely_considering_ending_everything/m7tyjyu/,Neutral
20275,m7u8a2h,comment,,I joined Rover but i still get no bookings . ive tried babysitting and even selling items on Facebook marketplace . im so tired . all of this and for what ? how long am I supposed to live like this . I appreciate your efforts but I'm just too tired . the thought of giving up is much more comforting than whatever this is, I joined Rover but i still get no bookings . ive tried babysitting and even selling items on Facebook marketplace . im so tired . all of this and for what ? how long am I supposed to live like this . I appreciate your efforts but I'm just too tired . the thought of giving up is much more comforting than whatever this is,2,,2025-01-18 18:14:11,t1_m7tvmxn,,https://www.reddit.com/r/confession/comments/1i4bn48/ive_been_genuinely_considering_ending_everything/m7u8a2h/,Neutral
20276,m7u6h2r,comment,,it does feel like I've died . i was doing so well   I worked as a cna but I hated it so I went down to retail but the pay difference really hurts me.., it does feel like I've died . i was doing so well   I worked as a cna but I hated it so I went down to retail but the pay difference really hurts me..,2,,2025-01-18 18:05:08,t1_m7tvx88,,https://www.reddit.com/r/confession/comments/1i4bn48/ive_been_genuinely_considering_ending_everything/m7u6h2r/,Neutral
20277,m7u7np0,comment,,"I just need something to eat , to make it to tomorrow . I'm so hungry man"," I just need something to eat , to make it to tomorrow . I'm so hungry man",1,,2025-01-18 18:11:03,t1_m7u5ycy,,https://www.reddit.com/r/confession/comments/1i4bn48/ive_been_genuinely_considering_ending_everything/m7u7np0/,Neutral
20278,m8014qo,comment,,"I'm sorry you're experiencing the same , it feels so trapping"," I'm sorry you're experiencing the same , it feels so trapping",0,,2025-01-19 16:15:20,t1_m7ysewz,,https://www.reddit.com/r/confession/comments/1i4bn48/ive_been_genuinely_considering_ending_everything/m8014qo/,Neutral
