Unnamed: 0,id,type,title,content,text,score,num_comments,created_utc,parent_id,sentiment,url,label
18977,m37c4tw,comment,,"First of all, it’s completely understandable that you’re feeling bad about asking for the money back, but it’s also okay to prioritize your own well-being, especially when you’re in a tough spot yourself. You’ve been incredibly generous already, and it’s not wrong to ask for what you’re owed, especially since you’re facing your own financial pressures.

Helping family is important, but it’s also important to recognize that you have your own needs, too. You did what you could to support your uncle when he was struggling, and now, with your own situation being uncertain, it’s perfectly reasonable to ask for that money back when you need it.

It's clear that you care a lot about your family and their struggles, and I’m sure your uncle understands how hard it is for you right now. You don’t have to feel guilty for setting boundaries and asking for what is rightfully yours. Money can be a tricky thing, especially when it comes to family, but you’re not being selfish—you’re just making sure that you can take care of yourself too.

Maybe in your next conversation, you can continue to express your understanding of his situation while also making it clear that you need to get the money back as soon as possible. You could say something like:

*""I really understand that you’ve had a tough year, and I want to be supportive. But I’m in a position now where I really need to have that money back. I know things are hard, but I would really appreciate it if we could arrange a plan to get it back sometime soon.""*

That way, you’re still being compassionate, but you’re also looking out for yourself. It’s okay to put yourself first sometimes, and your uncle will likely appreciate your honesty."," First of all, it’s completely understandable that you’re feeling bad about asking for the money back, but it’s also okay to prioritize your own well-being, especially when you’re in a tough spot yourself. You’ve been incredibly generous already, and it’s not wrong to ask for what you’re owed, especially since you’re facing your own financial pressures.

Helping family is important, but it’s also important to recognize that you have your own needs, too. You did what you could to support your uncle when he was struggling, and now, with your own situation being uncertain, it’s perfectly reasonable to ask for that money back when you need it.

It's clear that you care a lot about your family and their struggles, and I’m sure your uncle understands how hard it is for you right now. You don’t have to feel guilty for setting boundaries and asking for what is rightfully yours. Money can be a tricky thing, especially when it comes to family, but you’re not being selfish—you’re just making sure that you can take care of yourself too.

Maybe in your next conversation, you can continue to express your understanding of his situation while also making it clear that you need to get the money back as soon as possible. You could say something like:

*""I really understand that you’ve had a tough year, and I want to be supportive. But I’m in a position now where I really need to have that money back. I know things are hard, but I would really appreciate it if we could arrange a plan to get it back sometime soon.""*

That way, you’re still being compassionate, but you’re also looking out for yourself. It’s okay to put yourself first sometimes, and your uncle will likely appreciate your honesty.",1,,2024-12-21 22:43,t3_1hjjywo,,https://www.reddit.com/r/offmychest/comments/1hjjywo/i_feel_bad_about_asking_for_my_money_back/m37c4tw/,Neutral
18978,m2r7dq2,comment,,"I'm sorry to hear this, it can be really hard. I haven't been through as much trauma in my life as yours, so I won't say I understand all of what you are going through. Growing up, I had extreme anxiety about every aspect of my life. This anxiety led to me having depression and suicidal thoughts, though I masked it well. Suicide doesn't end the pain. It just passes it on to others. You should talk to someone in your life you trust and find professional help for your mental health problems. I know it can be scary opening up about how you are struggling, but finding help is how you can get to having better mental health. I hope you can find the help you need and get to a better place with your mental health."," I'm sorry to hear this, it can be really hard. I haven't been through as much trauma in my life as yours, so I won't say I understand all of what you are going through. Growing up, I had extreme anxiety about every aspect of my life. This anxiety led to me having depression and suicidal thoughts, though I masked it well. Suicide doesn't end the pain. It just passes it on to others. You should talk to someone in your life you trust and find professional help for your mental health problems. I know it can be scary opening up about how you are struggling, but finding help is how you can get to having better mental health. I hope you can find the help you need and get to a better place with your mental health.",1,,2024-12-19 1:33,t3_1hhg256,,https://www.reddit.com/r/offmychest/comments/1hhg256/i_see_no_reason_for_being_alive/m2r7dq2/,Neutral
18979,m2cgavz,comment,,Thank you. It’s sad I really try to be there for her and always have been but I’ve also always felt resentment from her. She even has said to my face that it’s unfair that our parents treatment of me and her is so different which she’s right and I agree but I didn’t do anything to make that happen so it hurts that she seems to blame me sometimes, Thank you. It’s sad I really try to be there for her and always have been but I’ve also always felt resentment from her. She even has said to my face that it’s unfair that our parents treatment of me and her is so different which she’s right and I agree but I didn’t do anything to make that happen so it hurts that she seems to blame me sometimes,1,,2024-12-16 16:06,t1_m2cfutm,,https://www.reddit.com/r/offmychest/comments/1hflyfp/i_feel_so_guilty_over_my_sisters_hell_of_a_life/m2cgavz/,Neutral
18980,m2cjj5v,comment,,"I agree. I’m so worried she’s going to find a way to take her husband back and what that will mean for my nephew. I’m already so sad for him and worried about his future and his mental health. He already has divorced parents (thankfully his dad and stepmom are decent), had to watch my sisters last toxic relationship, and now this and what he just witnessed is a whole other level. I’m also worried she will make him feel guilty for calling and being the reason for the relationship ending"," I agree. I’m so worried she’s going to find a way to take her husband back and what that will mean for my nephew. I’m already so sad for him and worried about his future and his mental health. He already has divorced parents (thankfully his dad and stepmom are decent), had to watch my sisters last toxic relationship, and now this and what he just witnessed is a whole other level. I’m also worried she will make him feel guilty for calling and being the reason for the relationship ending",1,,2024-12-16 16:23,t1_m2cj2o7,,https://www.reddit.com/r/offmychest/comments/1hflyfp/i_feel_so_guilty_over_my_sisters_hell_of_a_life/m2cjj5v/,Neutral
18981,m2bltdk,comment,,"It most definitely was assault.
At the tender age of 5 no one should have been touching you. Even if thy did not have sex with you the touching of such any underage person no matter if thy give consent or not is SA. 

You are most certainly allows to feel emotional about the event. And please do seek help from a professional if you still feel bothered by it. You are not being dramatic."," It most definitely was assault.
At the tender age of 5 no one should have been touching you. Even if thy did not have sex with you the touching of such any underage person no matter if thy give consent or not is SA. 

You are most certainly allows to feel emotional about the event. And please do seek help from a professional if you still feel bothered by it. You are not being dramatic.",4,,2024-12-16 12:54,t3_1hfi95q,,https://www.reddit.com/r/offmychest/comments/1hfi95q/im_too_ashamed_to_admit_that_i_was_taken/m2bltdk/,Neutral
18982,m2bnqke,comment,,"I'm really sorry you're feeling this way. What happened to you was not your fault, and you were a child who couldn’t understand or consent to what was happening. Feeling confused, ashamed, or unsure how to label the experience is completely normal, but please know that you’re not being dramatic—your feelings are valid.

You don’t have to carry this alone. Even if you never tell anyone in your life, talking to a therapist can be a safe and private way to begin processing what happened. They can help you navigate those feelings of shame and self-blame that are weighing you down. You deserve kindness, understanding, and a chance to heal.

If reaching out feels overwhelming, maybe consider writing down your thoughts in a private journal or in a supportive, anonymous online community. Even acknowledging your feelings like you did here is an incredibly brave step. Please remember, you are not defined by what happened to you, and you are worthy of support and compassion."," I'm really sorry you're feeling this way. What happened to you was not your fault, and you were a child who couldn’t understand or consent to what was happening. Feeling confused, ashamed, or unsure how to label the experience is completely normal, but please know that you’re not being dramatic—your feelings are valid.

You don’t have to carry this alone. Even if you never tell anyone in your life, talking to a therapist can be a safe and private way to begin processing what happened. They can help you navigate those feelings of shame and self-blame that are weighing you down. You deserve kindness, understanding, and a chance to heal.

If reaching out feels overwhelming, maybe consider writing down your thoughts in a private journal or in a supportive, anonymous online community. Even acknowledging your feelings like you did here is an incredibly brave step. Please remember, you are not defined by what happened to you, and you are worthy of support and compassion.",5,,2024-12-16 13:08,t3_1hfi95q,,https://www.reddit.com/r/offmychest/comments/1hfi95q/im_too_ashamed_to_admit_that_i_was_taken/m2bnqke/,Neutral
18983,m2bn8ei,comment,,Thank you for saying that. I just find it hard to believe because he's otherwise a good person, Thank you for saying that. I just find it hard to believe because he's otherwise a good person,2,,2024-12-16 13:05,t1_m2bm5eq,,https://www.reddit.com/r/offmychest/comments/1hfi95q/im_too_ashamed_to_admit_that_i_was_taken/m2bn8ei/,Neutral
18984,m2chqf9,comment,,"It makes no difference if it happen once or 100 times assault is assault.
It still left a impact on you, and you have every right to receive assistance in coping with it.

Depending in what country you are the trauma assist and SA assistance for minors is handled slightly different.
But in most cases there are actually child help lines that offer the opertinity to receive assistance rand counciling without involving the parents ( this also depends on the severity of the abuse aswell as the possibility of a repeat of the event).

Please try to find a councilor to assist you"," It makes no difference if it happen once or 100 times assault is assault.
It still left a impact on you, and you have every right to receive assistance in coping with it.

Depending in what country you are the trauma assist and SA assistance for minors is handled slightly different.
But in most cases there are actually child help lines that offer the opertinity to receive assistance rand counciling without involving the parents ( this also depends on the severity of the abuse aswell as the possibility of a repeat of the event).

Please try to find a councilor to assist you",1,,2024-12-16 16:13,t1_m2bmvai,,https://www.reddit.com/r/offmychest/comments/1hfi95q/im_too_ashamed_to_admit_that_i_was_taken/m2chqf9/,Neutral
18985,m2bqv8e,comment,,"No. He’s lived a long life convincing people that he’s a good person. It’s not the same thing. 

The reason he’s so good at it, is because these people are unwelcome everywhere. Nobody likes or tolerated pedofiles and they are in physical danger if people find them out. They also never have access to any children to abuse if the parents don’t trust them. 

So you know what happens…. They spend their entire life convincing people they’re a good person.

I strongly strongly imagine that this person thinks you have forgotten and that’s the only reason they’re so nice to you, so you doubt any memories and go “no that can’t be right”, because this is a survival technique for them. They aren’t nice or good people.

You are entirely free from guilt or blame. This person isn’t a nice person. They are a wolf in sheep’s clothing. 

Imagine like a salesman, it’s their job right. Back in the days of door to door salesmen, you had to put on a family friendly face, a respectable face, something that would get you invited in so you could chat more. It still happens today and salesmen / women are charismatic, friendly, laugh at your jokes, understand what your need and angle is, and then they bend to match it. That’s what makes good salesmen. They use their social skills to disarm us, and to sometimes guide us into making a decision we might not feel comfortable with. This is their job, they do it every day for years and it just becomes a natural part of who they are (charismatic, outgoing, chatty, trustworthy etc).

It’s the same with paedophiles. Except they have more at stake. They’re exceptionally skilled at making people trust them otherwise they don’t get what they want, could be out in prison, or attacked and seriously hurt.

They could of course, NOT TOUCH CHILDREN. But that would be what an actual decent human being would do."," No. He’s lived a long life convincing people that he’s a good person. It’s not the same thing. 

The reason he’s so good at it, is because these people are unwelcome everywhere. Nobody likes or tolerated pedofiles and they are in physical danger if people find them out. They also never have access to any children to abuse if the parents don’t trust them. 

So you know what happens…. They spend their entire life convincing people they’re a good person.

I strongly strongly imagine that this person thinks you have forgotten and that’s the only reason they’re so nice to you, so you doubt any memories and go “no that can’t be right”, because this is a survival technique for them. They aren’t nice or good people.

You are entirely free from guilt or blame. This person isn’t a nice person. They are a wolf in sheep’s clothing. 

Imagine like a salesman, it’s their job right. Back in the days of door to door salesmen, you had to put on a family friendly face, a respectable face, something that would get you invited in so you could chat more. It still happens today and salesmen / women are charismatic, friendly, laugh at your jokes, understand what your need and angle is, and then they bend to match it. That’s what makes good salesmen. They use their social skills to disarm us, and to sometimes guide us into making a decision we might not feel comfortable with. This is their job, they do it every day for years and it just becomes a natural part of who they are (charismatic, outgoing, chatty, trustworthy etc).

It’s the same with paedophiles. Except they have more at stake. They’re exceptionally skilled at making people trust them otherwise they don’t get what they want, could be out in prison, or attacked and seriously hurt.

They could of course, NOT TOUCH CHILDREN. But that would be what an actual decent human being would do.",2,,2024-12-16 13:31,t1_m2bn8ei,,https://www.reddit.com/r/offmychest/comments/1hfi95q/im_too_ashamed_to_admit_that_i_was_taken/m2bqv8e/,Neutral
18986,m2c6gs0,comment,,"Honestly you don’t know the reasons why they stopped.

It might have been the first and only time they acted on it. Still makes them bad.

It might have been the only time they did it to a relative and normally they only hurt children who don’t know them personally. 

Your parents might have been too present and watching you too carefully and they felt it too risky (this is the most likely reason IMO). 

They might only hurt children much younger to be sure that you don’t remember

I’m not trying to convince you he’s a bad person, even tho it might seem that way, I’m just trying to let you know that none of it has any impact on your innocence in the situation.

None of it makes it any less legitimately upsetting for you. 

They were the bad person, they never apologised, you have no idea how many times before or after you that they’d done this to people, but once is enough to cause harm. 

Look how it impacts you now. When the person chose to do this, they knew it would have long term negative impacts on the people they did it to, and they did it anyway. They called you into that bed. They planned it from even before that, it was just the first opportunity they had where they felt safe to risk it. These are not the actions of a good person, even if it was once.

I hope you know my messages are meant with kindness, I feel like you’re carrying some ownership in the situation and there’s none to be held by you, you are 100% innocent, you could have climbed into bed not realising, and tempted them and they gave in only once… they’re still bad for acting and you’re still innocent because you were an unknowing child with no power in the situation.

Imagine if this was like a discussion about infidelity … and you were giving a friend advice and their husband cheated by inviting an adult woman into their bed and then doing sexual acts.



You wouldn’t think.. oh well it was only once and he’s a nice guy. You’d think… he made a choice to cheat on his wife. He had options to not cheat, and he encouraged it and was the instigator.. you wouldn’t make excuses when you saw your friend hurt by this, you’d tell them their husband was morally wrong and was a bad husband, and doesn’t care about who they hurt.

The only difference is that in this situation, the other person was a consenting adult who was receptive to the sexual acts.

If the woman was for example… fast asleep. You’d think this husband was even worse, and dangerous! You’d think the other woman was innocent…

Now in your situation you were a literal child. There’s no way on this earth you had any blame in this. It might be hard to accept that this person wanted to hurt you, but it’s more that they just did not value or care about what impact it would have on you. Only in themselves. Which is what makes them a bad person.

No matter what ownership you might think you have in the situation, I promise you. You are innocent."," Honestly you don’t know the reasons why they stopped.

It might have been the first and only time they acted on it. Still makes them bad.

It might have been the only time they did it to a relative and normally they only hurt children who don’t know them personally. 

Your parents might have been too present and watching you too carefully and they felt it too risky (this is the most likely reason IMO). 

They might only hurt children much younger to be sure that you don’t remember

I’m not trying to convince you he’s a bad person, even tho it might seem that way, I’m just trying to let you know that none of it has any impact on your innocence in the situation.

None of it makes it any less legitimately upsetting for you. 

They were the bad person, they never apologised, you have no idea how many times before or after you that they’d done this to people, but once is enough to cause harm. 

Look how it impacts you now. When the person chose to do this, they knew it would have long term negative impacts on the people they did it to, and they did it anyway. They called you into that bed. They planned it from even before that, it was just the first opportunity they had where they felt safe to risk it. These are not the actions of a good person, even if it was once.

I hope you know my messages are meant with kindness, I feel like you’re carrying some ownership in the situation and there’s none to be held by you, you are 100% innocent, you could have climbed into bed not realising, and tempted them and they gave in only once… they’re still bad for acting and you’re still innocent because you were an unknowing child with no power in the situation.

Imagine if this was like a discussion about infidelity … and you were giving a friend advice and their husband cheated by inviting an adult woman into their bed and then doing sexual acts.



You wouldn’t think.. oh well it was only once and he’s a nice guy. You’d think… he made a choice to cheat on his wife. He had options to not cheat, and he encouraged it and was the instigator.. you wouldn’t make excuses when you saw your friend hurt by this, you’d tell them their husband was morally wrong and was a bad husband, and doesn’t care about who they hurt.

The only difference is that in this situation, the other person was a consenting adult who was receptive to the sexual acts.

If the woman was for example… fast asleep. You’d think this husband was even worse, and dangerous! You’d think the other woman was innocent…

Now in your situation you were a literal child. There’s no way on this earth you had any blame in this. It might be hard to accept that this person wanted to hurt you, but it’s more that they just did not value or care about what impact it would have on you. Only in themselves. Which is what makes them a bad person.

No matter what ownership you might think you have in the situation, I promise you. You are innocent.",1,,2024-12-16 15:10,t1_m2c1a5t,,https://www.reddit.com/r/offmychest/comments/1hfi95q/im_too_ashamed_to_admit_that_i_was_taken/m2c6gs0/,Neutral
18987,m1tkeri,comment,,"I wish I had something comforting to say, I’m so sorry this is happening to you and that people are being so cruel while you are suffering. This world is such a terrible place sometimes but the fact that you found each other means there is some good. I’m sending all my positive vibes to you both for his quick, and safe return. And a wish that you will both be able to relocate somewhere to freely love one another."," I wish I had something comforting to say, I’m so sorry this is happening to you and that people are being so cruel while you are suffering. This world is such a terrible place sometimes but the fact that you found each other means there is some good. I’m sending all my positive vibes to you both for his quick, and safe return. And a wish that you will both be able to relocate somewhere to freely love one another.",4,,2024-12-13 6:08,t3_1hd5tpo,,https://www.reddit.com/r/offmychest/comments/1hd5tpo/my_bf_got_conscripted_and_it_broke_me/m1tkeri/,Neutral
18988,m1uvfg7,comment,,"I really appreciate the reassurance. A part of me feels like I'm likely overreacting but then the rest of me only sees the possible horrible scenarios. 
I'm sorry that you have to be fighting this fight. I wish you all the best, stay safe out there."," I really appreciate the reassurance. A part of me feels like I'm likely overreacting but then the rest of me only sees the possible horrible scenarios. 
I'm sorry that you have to be fighting this fight. I wish you all the best, stay safe out there.",1,,2024-12-13 13:44,t1_m1umkql,,https://www.reddit.com/r/offmychest/comments/1hd5tpo/my_bf_got_conscripted_and_it_broke_me/m1uvfg7/,Neutral
18989,m1udk8j,comment,,"See there we go, you’re looking at the situation better already. Yes, get in the gym for yourself and him, he will be really proud of you.  I’m glad you’ll write the letters, add all the things you’ve wanted to say but never said. You’ve got this!  😌"," See there we go, you’re looking at the situation better already. Yes, get in the gym for yourself and him, he will be really proud of you.  I’m glad you’ll write the letters, add all the things you’ve wanted to say but never said. You’ve got this!  😌",2,,2024-12-13 11:22,t1_m1u7it7,,https://www.reddit.com/r/offmychest/comments/1hd5tpo/my_bf_got_conscripted_and_it_broke_me/m1udk8j/,Neutral
18990,m1uv1qp,comment,,"Thank you so much for saying so. I don't know if I feel like I've got this, but I'm going to try my best. I really do want to be the kind of person he can be proud of."," Thank you so much for saying so. I don't know if I feel like I've got this, but I'm going to try my best. I really do want to be the kind of person he can be proud of.",2,,2024-12-13 13:42,t1_m1udk8j,,https://www.reddit.com/r/offmychest/comments/1hd5tpo/my_bf_got_conscripted_and_it_broke_me/m1uv1qp/,Neutral
